离婚窗口排长队,0
电影《觅渡》首站路演走进原中央苏区,1
杭州第19届亚运会火炬传递启动,1
尚志市：恢复重建进行时,1
爱尔眼科三获“中华慈善奖”，将打造可持续眼健康公益生态,1
创意长图丨智能网联汽车的秘密，都藏在智博会里！,1
跨越海峡，音乐情牵  《台北姑娘》全网上线,1
2023北京国际安博会开幕 聚焦智慧赋能应急,1
2023北京国际安全应急产业博览会在京举行 聚合安全应急产业生态,1
 “甜蜜”产业成吐鲁番文旅发展新亮点,1
理财投资、电商平台……警惕这些传销新花样,1
十个重点行业稳增长举措陆续出台,1
打卡服贸会！画一张金融开放地图,1
2023年服贸会高峰论坛发布多项重磅报告 聚焦数字贸易、电子商务等行业热点和发展趋势,1
本届服贸会给参展企业带来了哪些商机？,1
“薪火”相传见深意：杭州亚运会火炬解读,1
我国注册志愿者超过2.3亿人,1
多彩民族有多彩丨在务川，邂逅百年古村落,1
看500里山水绘就的杭州图什么样？,1
智网、智驾、智造引领汽车产业变革——从2023智博会看我国新能源汽车发展新动向,1
《上甘岭》等三部大剧亮相服贸会“北京大视听”文艺精品展,1
全国跨省联网定点医药机构达47.51万家,1
活力亚运 辉映中国经济高质量发展实力,1
三星堆考古一线挑大梁的年轻人,1
文旅消费延展 新活力解锁精彩一夏,1
高质量发展调研行｜“风”“光”这边好——吉林发力清洁能源新赛道推进高质量发展,1
暴雨黄色预警！ “海葵”或长时间影响东南沿海部分地区,1
国家防总调整两省份防汛防台风应急响应级别,1
服务贸易持续成长 增量政策值得期待,1
多国代表团积极备战杭州亚运会 期待比赛带来新的精彩,1
又是一年开学季 从8000条新增专业记录 看未来发展,1
内蒙古呼伦贝尔301万亩小麦进入收获期 当地抢抓晴好天气昼夜抢收,1
“挂号、门诊线上支付 医保报销自动扣除” 北京26家医院医保移动支付上线,1
闻香识君子 热带寒舍发布首款产品“碧海澄澄”传承文化精粹,1
首创常温活性益生菌酸奶，安慕希再次领跑行业,1
建设中华民族现代文明和社会主义文化强国的行动指南,1
暑期超8200万人次出入境,1
雄安新区中关村科技园揭牌 未来将加快产业和创新资源要素集聚,1
橙色预警！台风“苏拉”巅峰强度堪比“杜苏芮”，或在这里登陆,1
第二届全国职业技能大赛重点赛项教练组长解读项目特色,1
第二届全国技能大赛特许商品发布 吉祥物“天天”和“津津”亮相,1
首届中国纪录片大会举办,1
台风“苏拉”靠近东南沿海风雨增强 中东部大部暑热渐消,1
依法处理58人！西安警方严厉打击演唱会“黄牛”,1
广东省防总启动防风Ⅳ级应急响应,1
秋季开学在即 公安部交管局部署学生交通安全管理工作,1
青海夏尔雅玛可布遗址发现3228座先秦墓葬,1
杭州亚运会运动员餐厅菜单确定，看看都有啥？,1
国家卫生健康委发布《手术质量安全提升行动方案（2023-2025年）》,1
电影《觅渡》首度光影呈现“常州三杰”故事,1
家电行业转型升级 消费潜力稳步释放,1
国家卫生健康委提出10条措施 推进基层卫生健康便民惠民服务,1
祝贺！中国女排U21世锦赛夺冠,1
国际乒联宣布首届混合团体世界杯落户成都 将于今年12月举行,1
 这里有家门口的幸福“味道”,1
新疆是个好地方,1
300多种濒危野生动植物种恢复性增长,1
300多种濒危野生动植物种恢复性增长 这是“万物共生”的中国答卷,1
2023暑期档票房超200亿元,1
沉浸式文旅促消费,1
博物馆要增加优质讲解服务供给,1
各地和有关部门多举措加快灾后重建,1
“浦江经验”在浦江：持续走好下访接访路,1
央行宣布调整！LPR一降一平释放什么信号？,1
一条高铁 跑出京津冀协同发展新速度,1
各地和有关部门加快灾后恢复重建,1
履职尽责 通力协作 狠抓落实,1
我国成为世界第一大船东国,1
吉林省税务部门及时推动政策落地见效,1
奋战在守护生命健康的第一线,1
央行报告：结构性工具持续支持重点领域和薄弱环节,1
助力亚运服务全球来华游客，支付宝推出全新国际版,1
“潮不停流”，北京三里屯“演变”登场,1
各地多措并举强化秋粮作物田间管理,1
重庆980多万亩水稻陆续成熟 机械化助力秋收,1
河北涿州：生产生活秩序加快恢复,1
暑期旅游旺季 多种玩法“上新”,1
海南省第七届少数民族传统体育运动会将于11月24日至29日在三亚和陵水举行,1
争分夺秒抢进度——河北涿州基础设施修复见闻,1
中央气象台发布暴雨黄色预警,1
跟着总书记看中国丨吉林黑土地上筑起中国大粮仓,1
在中华文明实践中探索 华裔青少年夏季研学营活动收官,1
第一届海外华裔青少年中华文化实践大赛颁奖典礼举行,1
美媒：强风导致夏威夷野火迅速蔓延，民众被迫跳到海里避难,1
华裔青少年北京行：留下梦想、友谊、奥运的记忆,1
坚决打赢防汛抗洪救灾遭遇战,1
实现由实践探索到科学理论指导的重大转变,1
地震发生后如何自救与互救？,1
扩大内需，打开增长新空间,1
直击京津冀、东北地区防汛抢险救灾最新进展,1
成都大运会乒乓球比赛收官，中国队包揽7金,1
北京房山：断路数日，十渡镇生命通道今日凌晨打通,1
“润泽江南” 复兴号亚运智能动车组启动首次试乘,1
最高检披露今年上半年侵犯知识产权犯罪新特点,1
黑龙江雅鲁河碾子山站预计8月5日下午将出现洪峰,1
黑龙江发布山洪灾害红色预警：哈尔滨、牡丹江有很高气象风险,1
吉林：强降雨来袭 多地展开防汛抢险救灾工作,1
传递书香之美 引领阅读风尚,1
上半年我国机器人产业总体保持稳定增长态势,1
中国气象局首次发布《极地气候变化年报》,1
降门槛提设施 汽车消费再迎政策利好,1
纪录片《追寻上海的犹太遗韵》在美举办首映仪式,1
8月哪些地方降水偏多？中国气象局发布气候趋势预测,1
大运会遇上巴蜀韵味 真的很搭！,1
城中村改造与保障性住房建设紧密结合,1
新疆维吾尔自治区教育科技领域主题教育调研成果转化交流推进会召开,1
"""大运之城""面面观｜武侯区:历史与现代交相辉映",1
引领健康咖啡浪潮 助力乡村振兴 “云南精品咖啡国际现货交易中心” 在云南保山启动,1
高温推高用电需求，局地供电紧张状况是否再现？,1
我国加快建立分级诊疗制度 ,1
权威部门就刑法修正案（十二）草案答记者问,1
这个小山村“土”里带点“潮”,1
惊爆！格尔木“炕锅美食之都”即将授牌，请做好准备！,1
齐齐哈尔体育馆坍塌事故已致10人死亡，尚有1人被困,1
这份《意见》，为民营经济吃下定心丸,1
“民营经济31条”：干货满满 落实为要,1
熊猫福宝成为亚太地区的“超级偶像”,1
暴雨蓝色预警！11省市有大到暴雨,1
国家医保局：及时将符合条件的养老机构内设医疗机构纳入医保,1
上交所、深交所联合发布《评价办法》：对上市公司重大违法违规行为“一票否决”,1
健康咖啡——搭建文化与商贸新桥梁 “云南精品咖啡国际现货交易中心” 启动仪式在京举行,1
中央和国家机关七家单位青年干部共同开展“赓续历史文脉 担当青年使命”主题联学活动,1
支付宝：外国朋友来中国，全国可刷支付宝,1
我国成立气象导航中心 进一步加强海洋气象预报服务能力,1
北京国际安全应急产业博览会将于9月开展,1
北方新一轮降雨今起发展 南方高温再度增强,1
共话中国经济新机遇丨中国经济前景备受海外期待,1
故宫博物院公开首批300余件甲骨高清影像,1
细节控请进！解锁《长安三万里》的服饰密码,1
水利部和气象局发布红色山洪灾害气象预警,1
推进国家治理体系和治理能力现代化的集中部署,1
 读懂中国经济韧性强、活力足,1
各国选手及体育官员对成都大运会充满期待,1
用数字技术弘扬传统文化,1
广东珠海制定行动方案助力湾区青年就业,1
河北雄安多措并举助力就业,1
两岸青年环骑北京：广交朋友，感受文化,1
2024欧洲杯官方款待项目在华开售,1
向战为战——南部战区党委机关深入开展主题教育纪实,1
各地采取务实举措助力高校毕业生就业,1
高温天气，这样健身更健康,1
上半年汽车出口超200万辆,1
以学促干，鼓足干事创业的精气神,1
我国托育机构已超7.5万家 提供托位360多万个,1
河北广平：建“互联网+居家”智慧养老新模式  让老人悦享生活,1
第二次青藏科考队精确测量珠峰顶部积雪厚度,1
新文旅“风”起洛阳 数字赋能让国宝“活”起来,1
赵乐际在山西调研：高质量推进新时代人大工作,1
北京：无人驾驶的出租车将正式上路,1
从1000万辆到2000万辆仅用17个月，这个提速很提气！,1
“生态文明”缘何成贵州关键词,1
贵州：特色生态农业助力乡村振兴迈向“绿富美”,1
水利部针对南方5省区启动水旱灾害防御Ⅳ级应急响应,1
民航局：依法从严从快从重打击机闹,1
2023世界人工智能大会今天开幕 首发首展新品达30余款,1
洪涝灾害后 健康防护这样做！,1
好消息！中国三人女篮排名升至世界第一,1
重庆万州五桥洪灾一线救援直击,1
东北强降雨今日继续打卡 华北地区高温卷土重来,1
@家长们，暑假期间这些安全知识要牢记,1
关帝文化旅游节暨东山关帝文化纪录片发布仪式开幕,1
成都大运会：青年人与一座城市的双向奔赴,1
新起点上书写“一国两制”香港新篇,1
海南三亚崖州湾科技城带动产业跨越式发展,1
新一届香港特区政府施政周年观察,1
我国首个万吨级光伏制氢项目投产,1
组织开展2023年急救与员工健康知识培训 提高自救互救能力,1
2023年中国网络文明大会将于7月18日至19日举办 在新起点上加快推进网络文明建设,1
超级飞侠大电影曝终极预告海报 预售开启,1
就业见习，助青年走出职场第一步,1
“考场外与母亲相拥”感动全网，他考得咋样？,1
即将召开的全国人大常委会会议看点前瞻,1
北京端午假期接待游客518.59万人次,1
多地迎来返程客流高峰 全国铁路预计发送旅客1515万人次,1
民宿管家、外卖运营师……这些新职业扩宽就业空间,1
白玉兰奖揭晓 第二十八届上海电视节圆满落幕,1
如何科学填报志愿？高考志愿填报指南来了,1
中央气象台继续发布高温橙色预警、暴雨黄色预警,1
端午假期首日 全国各地旅游景区迎来游客高峰,1
第54届巴黎航展举行 中国企业拿出亮眼参展清单,1
李强在德国巴伐利亚州参访,1
伊利健康谷工业旅游项目正式开园运营,1
宁夏银川一烧烤店发生燃气爆炸 现场搜救出38人,1
端午粽香，这几类人怎么健康吃粽子,1
毕业游叠加端午假期 旅游消费市场需求旺盛,1
"2023年第一季度""中国好人榜""发布",1
融合之路，城与乡双向奔赴,1
创新高！2022年全国独角兽企业数量达357家,1
端午夜可赏“飞龙在天”,1
南方多地强降雨来袭 多管齐下确保安全度汛,1
全国铁路7月1日起实行新的列车运行图,1
福建：谱写民营经济发展新篇章,1
焦点访谈：光影中相聚 梦想中成长,1
长江经济带发展“湖北答卷”,1
【花絮】发展商贸物流新模式 打造现代流通新高地,1
【冀时评论】建设物流强省 只争朝夕,1
商务部：正推进加入CPTPP进程,1
聚焦数字世界未来发展 山东曲阜这场“尼山对话”备受关注,1
Liquid State签约全球百大DJ 排名第一华人制作人Carta,1
一箭41星！中国航天发射创下一箭多星新纪录,1
广东制造业处处有智慧,1
今天 两位大神良渚相会,1
广州南沙协同港澳推进大湾区建设一年记,1
第三届中非经贸博览会涉及项目金额超100亿美元,1
跟着总书记看中国 | 赓续民族血脉 同绘华夏愿景,1
2023第二届警务英语大赛在浙江警察学院顺利举行,1
伊利重磅携手杭州亚运，为热爱勇立潮头,1
美国计划重返联合国教科文组织 外交部：不能把加入国际组织当做逛公园,1
商务部：非洲一体化进程将为中非经贸合作提供新机遇,1
 八旬“火山院士”刘嘉麒：一直在路上,1
景德镇古陶瓷基因库建设成绩亮眼,1
深圳和中山在伶仃洋海底实现“牵手”,1
中方驳斥：无中生有、信口雌黄、恶意诋毁！,1
新能源汽车下乡：政策接续发力 配套优化升级,1
福建启动首届网络文化节,1
中国影视剧“乘风破浪”到非洲,1
“两山”理念引领绿色发展,1
圆明园遗址公园举办“曾宪梓纪念日”活动,1
他曾捐资抢救圆明园遗址！曾宪梓纪念日，雕像前摆满鲜花,1
造良匠之师 育大国工匠,1
改革风劲鼓征帆  沈鼓集团混改一线观察,1
强信心·开新局丨河北廊坊：商贸物流产业“加速跑”赋能高质量发展,1
廊坊经洽会6月举行 聚焦商贸物流 共促协同发展,1
 中国-中东欧国家博览会亮点多多,1
全国夏收拉开序幕 夏收主要收什么？,1
主要指标回升明显 经济运行继续恢复向好,1
守护亚洲文化遗产 促进文明交流互鉴,1
2023年习近平法治思想重大主题宣传活动启动,1
一季度新设民营企业同比增长10.7%,1
究竟是怎样的硬汉？韧带断裂还勇夺第一……,1
“飞夺泸定桥”的党史“必修课”,1
凌家滩遗址考古发现揭示古老文化的生动面貌,1
城市：安全才能让生活更美好,1
时隔20年，中小商家再次站上时代新潮头,1
7月起全国范围实施汽车国六排放标准6b阶段,1
 超燃混剪 | 太空“快递小哥”成长记,1
提品质、强供给、重内涵——“网红”城市致力走向“长红”,1
跨省异地就医如何备案、如何结算？权威解答来了！,1
网信部门工作组进驻斗鱼平台,1
倒计时10天！第七届世界智能大会 亮出数字经济新“津”彩,1
月球上也有玻璃！嫦娥五号月壤中发现天然玻璃纤维,1
教育部：中小学教材不得夹带商业广告,1
中国科学家揭示太阳爆发的重构过程,1
4月末我国外汇储备规模为32048亿美元,1
在敦煌，聆听多元文明对话的回响,1
强降雨影响华南 中央气象台继续发布双预警,1
工信部通报！这56款APP（SDK）存在侵害用户权益行为,1
我国跨境资金流动均衡 外汇储备规模保持基本稳定,1
坚定历史自信 增强历史主动,1
我国与中东欧国家贸易产品附加值、科技含量提升,1
能源资源利用效率提升,1
天舟五号货运飞船顺利撤离空间站组合体,1
2023年全民数字素养与技能提升月江西省活动启动,1
海南省2023年全民数字素养与技能提升月正式启动 15项活动全面开启,1
“深地一号”钻头已钻至地下2290米,1
“赴淄赶烤”火了 更多城市“跃跃欲试”,1
一季度全社会用电量超2.1万亿千瓦时 ,1
东北三省一季度经济形势观察,1
寻味中国｜滇池边的这些小村庄，到底有多美？,1
奔跑在新赛道上｜数字造梦师,1
苟利军：“让星辰大海变得触手可及”,1
点击收藏五一高铁出行实用问答,1
天津推进基层治理体系和治理能力现代化水平整体提升,1
近期全国疫情防控形势总体平稳,1
旅游市场迎重要转折点 今年“五一”何以不同？,1
“诗与人民·江西诗派”诗歌朗诵会在九江举办,1
美了乡村富了乡亲！这些特色产业赋能乡村振兴,1
“五一”假期出行需求大幅回升 预计4月29日达到出行高峰,1
乡村图书馆 让“书香”溢满美丽乡村,1
2022年下半年大学英语四、六级加考(3月)成绩可查,1
春暖花开时 看“美丽”经济“一路生花”,1
第二届文旅博览会签约金额达1125亿元,1
闪耀太空！宇宙级中国式浪漫都藏在这些名字里,1
交通运输部：严格落实重大节假日免收小型客车通行费政策,1
我国首个大型页岩气田“气油并进” 页岩油产量突破2万吨,1
读书之美｜人间四月天 阅读正当时,1
五一假期临近 这份消费提示请收好,1
2023首都电视节目春推会如约而至,1
亮“舰”！人民海军成立74周年 远海作战能力跨越式提升,1
北方多地最高气温不足10℃ 陕西山西等地仍有强降雪,1
国际民调：“人才红利”已成中国发展强劲动力,1
铁路部门加大五一假期运力投放 增开旅客列车1500多列,1
第六届中文域名创新应用论坛：加快推动中文域名应用环境改善,1
这是一根命运相连的线,1
图知道｜保护地球，青年接力,1
“五一”假期民航预计运输旅客约900万人次,1
“寻路喜马拉雅 筑梦国际双流”——中尼民俗文化交流节活动圆满举行,1
全国已春播粮食面积超1.6亿亩 进度近两成,1
今日辟谣：杭州5月1日起实施房产新政？,1
追光 | 大运会倒计时100天 成都准备好了！,1
上海：聚焦实体经济 推进新型工业化,1
第133届广交会：外商云集 看好中国经济,1
耕地保护成效明显 筑牢粮食安全根基,1
共享开放机遇 共创美好生活,1
注册制改革有力推动资本市场高质量发展,1
广交会15日开展 参展企业数量创新高,1
警惕危害国家安全行为 这6个案例令人警醒,1
从消博会透视中国消费活力,1
我国首个数字孪生流域建设重大项目审批立项,1
五一假期火车票4月15日开售,1
这就是信心｜忙——物流加速跑,1
 一起来消博会打卡这些新场景,1
403秒！我国人造太阳创造新的世界纪录,1
海南离岛免税购物金额累计近1500亿元,1
城市书香，更多“悦”读方式,1
春风行动一季度发布岗位3800万个,1
多措并举 全面推进能源高质量发展,1
海南：努力成为新时代改革开放的示范,1
梯田为“布” 光影为“沙” 点亮乡村“夜经济”,1
高原观“海”满眼春 从生态产业看贵州高质量发展,1
新增作品300多万部！《2022中国网络文学蓝皮书》发布,1
春日市集、房车露营、竹筒奶茶 春暖花开之际各地消费亮点多,1
国际护胃日丨胃病发病呈年轻化 护“胃”要趁早,1
高温超导电动悬浮技术如何改变未来出行？,1
直播带岗“职”等你来,1
从绿色机遇透视中国经济活力,1
“北薯南种”打通了这条产业链,1
乡村生活综艺：打造现代人的“武陵源”,1
“英雄之光”系列思政课｜英雄魂归处,1
3月份国内大宗商品市场运行形势良好,1
“小而美”“烟火气” 夜间旅游新业态不断涌现,1
形式“新”起来 清明节俗“传”下去,1
促消费惠民生 便民生活圈繁荣社区商业,1
旅游市场持续回暖 激发消费新活力,1
福建：发展新兴产业 构建新发展格局,1
缅怀！2022年因公牺牲民警名单公布,1
消费新业态激发经济增长新活力,1
滇藏铁路云南段预计年内开通运营,1
黄河全域禁渔 母亲河如何重现生机？,1
电商助力 跑出兴农“加速度”,1
江西丰城：明前茶采摘忙,1
恰是一年春好处 带你寻春景、游春色、尝春味,1
穿越中国新坐标丨千年之城，未来之城,1
五个一百里看中国森林守护者,1
“大食物”如何托起舌尖上“小幸福”？,1
焦点访谈丨治理超采 保护水资源,1
在推动构建人类命运共同体的大道上阔步前进,1
农田专人管 增收又增产,1
以新气象新作为推动高质量发展取得新成效,1
全国水利工程供水能力超过8900亿立方米,1
我国今年首个核电机组开工建设,1
湖南常宁：春耕春种忙,1
重庆市解放碑—朝天门商圈采访记,1
麦田“新科技”大显身手！,1
春耕农技服务送下乡,1
首艘国产大型邮轮预计年底交付,1
殷墟“出圈”彰显文化自信,1
写给新征程上春天的中国,1
奋斗创造美好生活 拼搏绘就向上中国,1
我的种业故事｜一个“宝”，带来“新奔头”,1
1—2月经济运行企稳回升 今年开局如何看?,1
一粒小麦良种 支撑粮食增产大图景,1
“五个一百”，汇聚团结奋进的强大正能量,1
模拟“自然降水” 农技人员用科技夯实丰产基础,1
为推进强国建设、民族复兴作出应有贡献,1
李强总理首次记者会主席台有9把椅子,1
风清气正 凝心聚力——2023年全国两会会风观察 ,1
共赴奋进征程 同谱华章日新,1
众望所归聚民心 掌舵领航向复兴,1
劳动力市场迎来“开门红” 新型用工模式保障稳定就业,1
书写人民满意司法答卷 在“两高”报告中读懂法治中国,1
以高质量公共文化服务增强人民精神力量,1
青年向上 国家向前,1
“光明的路，我们越走越宽敞！”,1
中国旅游研究院：预计今年国内旅游人数约45.5亿人次,1
山东济宁：文化“两创”为乡村振兴注入“活水”,1
陕西：做强实体经济 构建现代产业体系,1
内蒙古：布局新能源赛道 推动绿色发展,1
人民网评：以重大主题展现活力的中国,1
全面实行股票发行注册制正式实施,1
“新时代新机遇——跨国企业在中国”网上主题宣传启动,1
商务部：在试点基础上全面推进便民生活圈建设,1
赶订单忙生产 全力推动工业经济积极恢复,1
从“一条曲线”看经济增速回暖,1
最新调查：台湾青年幸福感受度处于及格线边缘,1
国台办：支持台湾农渔民分享大陆发展机遇,1
“亚洲花都”看中国消费加速回暖,1
不负春光！中国春耕图鉴,1
各地抢抓农时全力保障春耕春种,1
便捷出行联通万家团圆 带动经济加速跑,1
怎样看待门诊共济保障改革,1
国家医疗保障局办公室关于进一步做好定点零售药店纳入门诊统筹管理的通知,1
统筹疫情防控和经济社会发展的中国答卷,1
创新创造绽放文旅多彩魅力,1
中办国办印发意见 进一步加强财会监督工作,1
强国必先强农 农强方能国强,1
焦点访谈：大山里的地下实验室,1
北京扶持实体书店发展,1
“五个一百”：扬帆新征程，奋斗正当时,1
四部门部署保障春季学校食品安全,1
从关键词看新任务 这份文件惠农利农“干货”多,1
亚洲最深油气勘探直井在四川盆地顺利完钻,1
深化两岸各领域融合发展,1
“中国光谷”：走科技自立自强之路,1
中国科幻底气来自“大国重器”的实力,1
2023年首月全国各地经济社会发展扫描,1
国企改革三年行动主要目标任务已经完成,1
“归雁”返乡就业创业，底气在哪,1
文化+旅游，让这个县焕发“新活力”,1
焦点访谈丨红红火火舞新春,1
春耕备耕忙,1
真抓实干 广东聚力推动高质量发展,1
春节期间全国疫情防控工作平稳有序,1
低流行≠没风险 要坚持做好自我防护,1
中央冬春救助资金全部发放到位,1
"财政政策积极有为 2022财政收支""成绩单""公布",1
【青春匠心】香港女孩郑紫欣：学化学 做靓食,1
全程免费！他们乘专列去广东打工,1
（新春见闻）香港龙狮跃动贺新春,1
 看广东如何播下“春天第一粒种子”,1
我国“一村一品”示范村镇累计达到4068个,1
经济复苏年味浓,1
年过完了也要记得常回家看看,1
春节后开工首日，各地在忙些啥？,1
春节档电影票房超67亿元,1
新的春天 新的征程 新的出发,1
新春消费旺 假期出游热度高,1
焦点访谈：热“雪”沸腾喜迎春,1
年味浓活力增 兔年消费开门红,1
新春万象新 实干促发展,1
文旅融合推动太行山区农村走上致富路　,1
春节忙订单，外贸大省热情奋战开门红,1
大年初七广东召开全省高质量发展大会,1
“中国经济将成为世界经济增长的‘火车头’ ”,1
山东：让“黄金政策”发挥“黄金效应”,1
春节消费展现经济脉动,1
新华全媒+｜来看摄影师镜头下的中国年,1
动感·广东,1
哈哈哈哈！名场面来了！,1
送给每一位妈妈！《是妈妈是女儿》网友版MV,1
复常：香港新年关键词,1
加强医疗资源调配 有效提升救治水平,1
小医院一线守护 大专家远程搭脉,1
各地台商送新春祝福,1
（新春走基层）“登陆”台胞的不打烊春节：在忙碌中感受生活气息,1
（新春见闻）台青在温州的别样年味：“两岸三家”奔赴更好明天-中新网,1
（新春走基层）返乡台商台胞的过年“新心态”,1
坚守航天测控一线！他们和“星星”一起过大年,1
24小时运转守护万家“烟火气”,1
新年 记者跟家庭医生上门：只想好好守护他们,1
新疆：充分发挥区位优势 推动外贸提质升级,1
新春走基层丨特写：绿水青山里的新年景,1
春运返程客流1月24日起开始增长,1
健康过年的正确姿势 快来解锁！,1
冬季长达190天的黑河，缘何吸引世界众多车企驻足？,1
海拔5300米！边防官兵踏上风雪巡逻路,1
旅游市场火爆 多地景区紧急限流提醒,1
