离婚窗口排长队,0
专家称，如果丹尼尔·潘塔莱奥警官在埃里克·加纳案中受到指控，司法部将面临上坡战,0
反特朗普暴力席卷全国,0
由于担心选举日的麻烦，一些美国学校取消了课程,0
明尼苏达州索马里团体在国会大厦异口同声,0
冈比亚与非和布隆迪一起逃离国际刑事法院,0
战争中的巴黎：媒体的沉默,0
我们的新国家：妇女和少数民族遭受的打击最大,0
特朗普承诺“为美国黑人新政”,0
底特律最可怕的学校是违宪的吗？,0
示威者在蓝猫咖啡馆外抗议，称涂鸦不是他们的,0
阿姆斯特朗：停止试图对种族进行圣殿攻击,0
芝加哥“反击”，剥夺特朗普的荣誉街道称号,0
不要为来自克利夫兰的种族主义红脸队加油,0
学生抗议“天皇”缺乏对有争议的过去的参与,0
2015年日本人口自1920年以来首次下降,0
中国移民要求保护免受巴黎麻瓜的袭击,0
Facebook允许广告商按种族排除用户,0
媒体对特朗普的自我毁灭,0
特朗普向黑人伸出援手；费城黑人暴乱,0
一些城市希望非公民移民投票,0
伊利诺伊州参议员因种族指控袭击对手家人而被解雇,0
堪萨斯州议员告诉抗议者，“回到你声称回家的地方”,0
Rancher Yearns在美墨边境寻找特朗普墙,0
49人队球迷比卡佩尼克更关心胜利,0
联合国：2016年地中海移民死亡人数创历史新高,0
荷兰反伊斯兰议员维尔德斯将对仇恨言论进行审判,0
加莱营地关闭，更多移民在巴黎街头搭建帐篷,0
加拿大教授说，独木舟充斥着种族灭绝、盗窃和白人特权,0
看到西方化危险的中国人,0
与科曼奇人的战争,0
本周评论，2016年10月30日,0
“一个国家的诞生”炸弹,0
扩展采访：Jorge Ramos与Jared Taylor谈论比赛,0
另类右翼的崛起,0
仇恨上升与豪尔赫·拉莫斯,0
谁付给希拉里·克林顿2170万美元做演讲？,0
“我们正在失去对街道的控制”默克尔领导的德国陷入无法律状态,0
早期投票数据显示非裔美国人投票率下降,0
随着竞争的加剧，克林顿竞选团队指望少数族裔的支持,0
研究发现优步和Lyft司机存在种族歧视,0
血腥十月过后，芝加哥凶杀案突破600起,0
特警队对峙嫌疑人与Zionsville谋杀案、IMPD总部枪击案有关,0
教授发现，大多数大学生认为美国发明了奴隶制,0
濒临崩溃的瑞典？移民潮中的暴力事件使警察部队濒临崩溃,0
特恩布尔将提出法律，永久禁止来自澳大利亚的寻求庇护者,0
2016年动乱背后，白人身份危机,0
黑人在提前投票中投票疲软，对希拉里·克林顿不利,0
克林顿的支持者比副总统Versa更难尊重特朗普的支持者,0
这位教授毕生致力于反对危险言论。她不能忽视唐纳德·特朗普的。,0
民意调查：千禧一代如何看待土地管理局和另类右翼,0
因此，这是种族主义,0
白人学生成立白人唯一团体以打击白人种族主义,0
罗恩·保罗：垄断应归咎于政府，而非市场,0
司法部一再试图扼杀联邦调查局对克林顿基金会的调查,0
达科他州接入管道：抗议者被赶出营地，100多人被捕,0
梵蒂冈与中国政府达成前所未有的协议,0
俄罗斯和北约并排举行战争演习,0
联邦调查局认为特朗普和普京之间没有联系,0
北约和俄罗斯将在巴尔干半岛举行平行演习,0
韩国海岸警卫队向中国船只开火,0
据报道，马克·鲁法洛被列入美国恐怖分子观察名单,0
普京因叙利亚战争罪在联合国受审,0
科米调查一条红鲱鱼掩盖维基解密垃圾场,0
卡特透露升级美国远程火箭,0
俄美钚协议不再生效,0
一半俄罗斯人担心叙利亚可能引发第三次世界大战,0
美国联邦调查局公布克林顿基金会调查记录,0
俄罗斯最强大的武器：“囤积黄金”,0
中国机场安检机器人触电,0
维基解密文件披露联合国对不明飞行物的兴趣,0
涉嫌“伏击式”杀害两名爱荷华州警察的嫌疑人被抓获,0
Bundy兄弟从俄勒冈州监狱获释，与美国法警一起前往内华达州,0
警告还是威胁？希拉里暗示，如果特朗普获胜，将爆发第二次内战,0
总统选举临近，美国民兵组织准备制造麻烦,0
唐纳德·特朗普是克格勃间谍？,0
普京授予史蒂文·西格尔俄罗斯公民身份,0
新型仿生眼植入物直接连接大脑,0
《美国快报》因亲巴勒斯坦观点否认平克·弗洛伊德歌手罗杰·沃特斯,0
警察向管道抗议者发射橡皮子弹,0
报告：美国联邦调查局对克林顿基金会的调查“可能”导致起诉,0
近70年来最大的11月超级月亮,0
阿勒颇武装分子发动大规模新袭击，RT机组人员遭到袭击（视频）,0
美国领导的空袭造成至少30名阿富汗平民死亡,0
抗议者和警察仍在为有争议的北达科他州管道发生冲突,0
美国发生政变,0
陪审员对Ammon Bundy裁决的解释,0
道格·凯西：大选后可能会爆发内战,0
美国联邦调查局认为克林顿基金会案件走向“可能被起诉”,0
男男性行为者在选举前准备希拉里获胜结果被捕,0
朱利安·阿桑奇将发表预先录制的RT采访（11/5/16）,0
分析师：大多数美国人都不喜欢这两位候选人,0
探测到地球磁屏蔽出现裂缝,0
联邦调查局警告纽约市官员基地组织可能发动袭击,0
🚨比尔克林顿和希拉里洛丽塔快递恋童癖戒指🚨,0
雷诺特朗普集会骚乱的幕后主使,0
观点：希拉里是巴比伦的妓女，不是人类,0
美国军事黑客声称渗透俄罗斯,0
美国正处于内战的边缘吗？,0
特朗普在竞选演说间隙欣赏“美丽”的特朗普面具,0
唐纳德·特朗普以佛罗里达州的集会拉开了最后一个竞选日的序幕,0
克里姆林宫：北约是为侵略而建立的,0
希拉里·克林顿在选举日前一天领先,0
美国首位女司法部长珍妮特·雷诺去世，享年78岁,0
5.0俄克拉荷马石油枢纽附近的地震造成严重损坏,0
拉斯维加斯可能成为新阿姆斯特丹,0
俄罗斯和中国寻求自主金融体系,0
沙特最严重的经济衰退即将到来,0
指控科米犯有叛国罪并清除整个联邦调查局,0
美国军方准备关闭俄罗斯的互联网，如果它破坏了选举,0
赤裸上身的抗议者在特朗普的投票站被捕,0
北约战斗机在波罗的海国家上空持续监视俄罗斯战斗机,0
选举气氛为你和你的家人设置音乐,0
2009年闪回：《如果》混音,0
Lady Gaga在特朗普大厦外抗议唐纳德·特朗普,0
特朗普大厦被自卸卡车包围，预计会发生暴力事件,0
高呼“不是我的总统！”在特朗普获胜后，在加利福尼亚州,0
精英们秘密“寄希望于特朗普的胜利”,0
俄罗斯将用巡航导弹打击阿勒颇的伊斯兰国,0
美国最大天然气管道发生大规模致命爆炸，DAPL抗议者被证明是正确的——匿名,0
美国有线电视新闻网曝光：用自己的摄像师做特朗普抗议者,0
在Standing Rock将警察军事化的管道亿万富翁,0
推特之门正在发生。发现1000个推特恋童癖账户,0
资本主义注定要灭亡——没有其他选择，我们也是,0
关于叙利亚的许多“真相”：我们的竞争如何摧毁了一个国家,0
法国新法律规定下班后联系员工是违法的,0
9/11消防员发现炸弹摧毁世贸中心大厅,0
俄罗斯研究人员在北极发现纳粹秘密军事基地“寻宝人”[照片],0
匿名在线警戒小组帮助监禁恋童癖者,0
研究人员意外找到将有害二氧化碳气体转化为绿色能源的简单方法,0
一名妇女的土地被DAPL偷走后因自己的财产被捕,0
“Dillary Trumplon”：这家伙的史诗说唱歌曲刚刚摧毁了特朗普和希拉里,0
希拉里在泄露的电子邮件中承认克林顿的捐赠者正在资助ISIS,0
突破：奥巴马为保护希拉里·克林顿竞选白宫而撒谎的无可辩驳的证据阅读,0
美国政府承认基地组织不是叙利亚的优先事项,0
美国联军空袭在叙利亚造成至少300名平民死亡,0
无政府主义者、自由主义者、黑客和计算机极客组成的政党将在冰岛掌权,0
普京警告“美国已将俄罗斯推回核军备竞赛”,0
叙利亚又发生一起学校爆炸案：22名儿童和6名教师死亡,0
美国领导的空袭袭击伊拉克一所学校，造成60名平民死亡，200人受伤,0
北约确认在东欧建立主要部队,0
Siri可以打开智能锁，让邻居走进你的房子,0
什么是匿名者？,0
用狗袭击原住民的DAPL警卫没有安全工作许可,0
维基解密名单揭露至少65家企业“新闻机构”合谋隐瞒克林顿罪行,0
美国国家橄榄球联盟警告称，牛肉中的瘦肉精含量过高，以至于球员无法通过药物测试,0
关于达科他州接入管道抗议活动你需要知道的5件事,0
杂草之战：拜耳孟山都公司研发转基因公司大麻？,0
如果美国被洗劫一空会发生什么？,0
美国不想让你知道叙利亚战争罪行的真相,0
联合国通过呼吁禁止核武器的里程碑式决议，美国投反对票,0
普京：“俄罗斯不会攻击任何人”,0
阿什顿·库彻营救6000名性交易受害者，逮捕2000多名贩运者[视频],0
证据：吃生大麻可以预防癌症，但不会让你兴奋,0
希拉里讨论操纵巴勒斯坦选举的音频泄露,0
数千头水牛出现在立石抗议现场[观看],0
提供免费和高级服务的最佳密码管理器列表,0
研究人员发现来自恒星的奇怪信息，称可能是外星人,0
ISIS在阿富汗绑架并杀害至少30名平民,0
叙利亚空袭在伊德利卜造成35名平民死亡,0
北约确认在东欧进行大规模集结,0
以色列：古代纸莎草证明耶路撒冷属于以色列,0
美国退出联合国投票反对古巴禁运,0
自停火结束以来，也门的战斗造成至少37人死亡,0
随着ISIS抵抗力量的壮大，伊拉克在摩苏尔以的攻势停滞不前,0
美国：库尔德军队将参与入侵伊斯兰国首都拉卡,0
干预主义的终结？,0
联邦调查局怎么了？,0
执行死刑的人看不到尽头；256人在伊拉克丧生,0
15岁的爱国者法案：你觉得更安全吗？,0
联合国也门和平计划将取代前总统哈迪,0
美国声称在过去18个月内从伊朗到也门的四艘军火船被捕,0
普京：俄罗斯不会攻击任何人,0
美国：800-900名ISIS“可能”在摩苏尔战斗中丧生,0
美国指挥官：在ISIS对西方发动袭击之前，我们必须征服拉卡,0
美国将推迟与俄罗斯的网络战争直到大选结束,0
土耳其与库尔德人的竞争可能使拉卡入侵更加复杂,0
逃离摩苏尔的人面临立即处决,0
俄罗斯和美国喷气式飞机在叙利亚上空“险些失手”,0
美国在阿富汗的无人机袭击造成数名平民伤亡,0
普京拒绝俄罗斯军队恢复阿勒颇空袭的呼吁,0
努斯拉阵线在叙利亚阿勒颇附近发动新攻势,0
马来西亚将从中国购买船只，再次打击美国的地区主导地位,0
什叶派民兵加入伊拉克对摩苏尔的袭击,0
大赦国际警告不要在袭击摩苏尔时使用白磷,0
以色列对加沙的封锁本质上是暴力的,0
女兵：被遗忘的战争伤亡,0
部队暂停向摩苏尔推进前，78人在伊拉克丧生,0
75年来的良好战争预算,0
夜幕降临，一线希望,0
美国空袭在摩苏尔附近炸死四名伊拉克士兵,0
关于希拉里·克林顿电子邮件Fiasco的两点,0
200人在伊拉克丧生；什叶派民兵加入摩苏尔战役,0
沙特战机多次轰炸也门监狱，造成60人死亡,0
美国监察长：阿富汗政府夏季迅速失去领土,0
亲沙特势力推动联合国和平协议，也门分治的可能性增加,0
沙特对也门村庄的空袭造成27名平民死亡,0
联合国在被指控的毒气袭击中猛烈抨击阿勒颇叛军,0
什叶派民兵进入摩苏尔战役，但目光投向叙利亚战争,0
叙利亚观察站：过去两周，300名伊斯兰国儿童兵在摩苏尔周围被杀,0
伊拉克民兵领袖：摩苏尔之战不会是野餐,0
普京-奥巴马信任度蒸发,0
一位退伍军人与伊斯兰恐惧症的战争,0
该怎么办？,0
255人在伊拉克丧生；巴格达遭炸弹袭击,0
俄克拉荷马市天主教工作者呼吁抵制2016年军事总教区国家收藏,0
反对派对叙利亚阿勒颇的袭击进展缓慢，但平民伤亡人数上升,0
伊斯兰国在贾拉拉巴德自杀式袭击中杀害阿富汗部落长老,0
美国将军：战机将在摩苏尔附近杀死逃跑的伊斯兰国武装分子,0
叙利亚军队进入大马士革新城，将叛军进一步击退,0
军情五处处长称俄罗斯对英国利益构成日益严重的威胁,0
美国呼吁沙特停止对也门的空袭,0
第一批伊拉克军队进入摩苏尔，但战斗仍主要在郊区进行,0
奥巴马任期的结束：拉丁美洲的成绩单,0
为沙特在也门的屠杀行为辩护,0
核武器——现在是废除核武器的时候了,0
5561人10月在伊拉克被杀,0
必须战胜伊斯兰恐惧症,0
新民调：15年战争后美国人感到不那么安全,0
美国空袭在摩苏尔附近炸死8名平民,0
印度和巴基斯坦军队在克什米尔交火，造成24人死亡，其中大部分是平民,0
俄罗斯：反对派在阿勒颇周围的袭击Jeopardize暂停空袭,0
联合国：阿勒颇各方可能犯下战争罪,0
俄罗斯国防部长：叙利亚和谈无限期推迟,0
土耳其在伊拉克边境部署坦克和火炮,0
让我们减少美国的核武库,0
美国官员认为特朗普与俄罗斯之间没有联系,0
伊斯兰国在摩苏尔周边地区杀害前士兵,0
谁从哥伦比亚的永久战争投票中获益？,0
希拉里·克林顿如何毒害美国政治,0
伊拉克军队进一步推进摩苏尔；202人在伊拉克丧生,0
五角大楼寻求60亿美元用于海外部队部署,0
俄罗斯将阿勒颇停火延长至周五，敦促叛军撤离,0
国防部长：美国与土耳其讨论未来在拉卡的作用,0
伊拉克援助机构为平民逃离摩苏尔做好出逃准备,0
伊拉克精锐部队在摩苏尔周围被ISIS战术拖垮,0
巴勒斯坦人为什么要起诉英国：《贝尔福宣言》发表99年,0
朝鲜的核生存门票,0
前北约首脑：我们需要美国作为“世界警察”,0
美国承诺3000万美元重建乌克兰海军,0
巴基斯坦召回印度外交官，威胁驱逐印度特使,0
摩苏尔附近报道的宗派战争罪行；283人在伊拉克丧生,0
美国空袭造成昆都士周围至少30名阿富汗平民死亡,0
阿桑奇证实：维基解密没有收到俄罗斯政府的电子邮件,0
反对派升级对阿勒颇西部的袭击，造成12名平民死亡,0
努斯拉阵线，盟军在阿勒颇袭击叙利亚叛军,0
伊拉克总理威胁就土耳其军事集结发动战争,0
ISIS领导人对摩苏尔防御充满信心，排除撤退,0
罗恩·保罗谈ISIS：致命威胁还是纸老虎？,0
叙利亚库尔德人警告美国：土耳其不能卷入拉卡入侵,0
报道：沙特暗中支持联合国也门和平计划,0
五角大楼：到目前为止没有美军进入摩苏尔的计划,0
约旦军队在空军基地杀死三名美军教官,0
美国威胁在选举期间对俄罗斯电力和通信网络进行军事黑客攻击,0
联合国报告：阿富汗约有45000名反对派战士,0
美国官员试图用恐怖威胁恐吓选民,0
随着伊拉克军队逼近摩苏尔，平民伤亡开始上升,0
愤怒的哀悼者埋葬美国在阿富汗北部空袭的平民受害者,0
普京总统：俄罗斯联邦支持查谟和克什米尔的自决权，印度军队充当无情的土匪,0
ISIS宣布将“一个接一个”杀害巴勒斯坦人，但对以色列保持沉默,0
普京总统：俄罗斯联邦支持查谟和克什米尔的自决权，印度军队充当无情的土匪,0
ISIS宣布将“一个接一个”杀害巴勒斯坦人，但对以色列保持沉默,0
希拉里的电子邮件调查期间，克林顿竞选主席与司法部高级官员共进了多次晚餐,0
希拉里建立了有史以来规模最大的大公司,0
维基解密证实希拉里向伊斯兰国出售武器,0
高级助手：希拉里“头脑仍然不完美”，维基解密,0
特朗普中断共和党筹款活动,0
希拉里亲自下令发起“唐老鸭”巨魔运动,0
IBD/TIPP跟踪民调：特朗普以43%的支持率领先克林顿,0
希拉里朋友贿赂联邦调查局特工和他的妻子,0
给希拉里5000万美元的阿拉伯王子恳求美国人不要投票给特朗普,0
伊拉克逊尼派全体会议以强调一致性和团结一致应对威胁而结束,0
四个阿拉伯国家从丰田购买了数千辆汽车并将其交付给“Daesh”,0
英国在也门战争罪行报道中训练沙特飞行员,0
美国和以色列立法者希望巴基斯坦被宣布为恐怖国家,0
破产：比尔录制了告诉情妇否认克林顿帮助她获得州工作的录音,0
蒂姆·凯恩：“天主教会将改变其同性婚姻立场，否则将被禁止进入美国”,0
希拉里：“我们在利比亚没有失去一个重要人物”,0
维基解密：克林顿的亲信为基金会筹集资金，得到比尔的报酬,0
希拉里计划在特朗普获胜后逃离，向QATAR转账18亿美元,0
爱荷华州农民声称比尔克林顿在“可卡因派对”期间与奶牛发生性关系,0
克林顿的亲信将数百万人引向基金会和比尔的钱包,0
拜登将经济归咎于“懒惰的美国女性”：“她们无所事事，只有希拉里才能强迫她们工作”,0
特朗普呼吁在学校教授“爱国主义”,0
兰德·保罗：民调显示希拉里领先“旨在抑制投票率”,0
沙特驻阿联酋大使：应检查与伊朗、伊拉克、叙利亚和黎巴嫩的任何接触,0
埃尔多安：美国，ISIS的创始人,0
民意调查：41%的选民表示选举可能被“偷走”,0
希拉里·克林顿被控盗窃国务院家具,0
WIKILEAKS：希拉里为克林顿慈善机构获得1200万美元，作为摩洛哥会议的问答题,0
特朗普警告称，如果克林顿当选，将爆发第三次世界大战,0
奥巴马抨击特朗普“操纵”选举的说法“危险”,0
唐纳德·特朗普声称选举将被“操纵”，批评者称这是荒谬和危险的,0
特朗普表示，他将对以色列人和巴勒斯坦人保持“中立”,0
破产：比尔录制了告诉情妇否认克林顿帮助她获得州工作的录音,0
蒂姆·凯恩：“天主教会将改变其同性婚姻立场，否则将被禁止进入美国”,0
维基解密：克林顿的亲信为基金会筹集资金，得到比尔的报酬,0
希拉里计划在特朗普获胜后逃离，向QATAR转账18亿美元,0
爱荷华州农民透露，比尔·克林顿在“可卡因派对”期间与奶牛发生性关系,0
克林顿的亲信将数百万人引向基金会和比尔的钱包,0
拜登将经济归咎于“懒惰的美国女性”：“她们无所事事，只有希拉里才能强迫她们工作”,0
特朗普呼吁在学校教授“爱国主义”,0
兰德·保罗：民调显示希拉里领先“旨在抑制投票率”,0
沙特驻阿联酋大使：应检查与伊朗、伊拉克、叙利亚和黎巴嫩的任何接触,0
民意调查：41%的选民表示选举可能被“偷走”,0
希拉里·克林顿被控盗窃国务院家具,0
WIKILEAKS：希拉里为克林顿慈善机构获得1200万美元，作为摩洛哥会议的问答题,0
特朗普警告称，如果克林顿当选，将爆发第三次世界大战,0
奥巴马抨击特朗普“操纵”选举的说法“危险”,0
唐纳德·特朗普声称选举将被“操纵”，批评者称这是荒谬和危险的,0
特朗普：希拉里·克林顿可能是“有史以来最腐败的人”竞选总统,0
特朗普表示，他将对以色列人和巴勒斯坦人保持“中立”,0
唐纳德·特朗普威胁要监禁希拉里·克林顿,0
特朗普指责奥巴马和希拉里·克林顿创立Daesh,0
特朗普指责奥巴马和希拉里·克林顿创立Daesh,0
特朗普：希拉里·克林顿可能是“有史以来最腐败的人”竞选总统,0
唐纳德·特朗普威胁要监禁希拉里·克林顿,0
希拉里：“我们在利比亚没有失去一个重要人物”,0
叙利亚杜马，ISIS使用工业揉面机杀害250名儿童，并在面包炉中烘烤成年人,0
北卡罗来纳州希拉里的支持者在脸书上多次吹嘘投票,0
夏洛特地区3个县报告投票机选错了候选人,0
贾森·查费兹揭露了希拉里·克林顿贿赂联邦调查局特工以释放她的计划,0
维基解密：电子邮件证明民主党操纵民意调查,0
布拉德·皮特震惊美国：“我厌倦了自由党拿走我的钱。我要投票给特朗普！”,0
叙利亚杜马，ISIS使用工业揉面机杀害250名儿童，并在面包炉中烘烤成年人,0
这位前国会议员在推特上说，“如果特朗普输了，我就要拿起火枪。”,0
知情人士泄露比尔对希拉里的两个字昵称，暴露肮脏的坏习惯,0
Reddit用户向希拉里的付费网络巨魔宣战,0
对特朗普的恐惧：布什、奥巴马、克林顿都在非采掘国购买房产,0
北卡罗来纳州希拉里的支持者在脸书上多次吹嘘投票,0
夏洛特地区3个县报告投票机选错了候选人,0
贾森·查费兹揭露了希拉里·克林顿贿赂联邦调查局特工以释放她的计划,0
布拉德·皮特震惊美国：“我厌倦了自由党拿走我的钱。我要投票给特朗普！”,0
杰基·梅森：希拉里·克林顿不配当浴室服务员——她会偷厕纸,0
知情人士泄露比尔对希拉里的两个字昵称，暴露肮脏的坏习惯,0
Reddit用户向希拉里的付费网络巨魔宣战,0
对特朗普的恐惧：布什、奥巴马、克林顿都在非采掘国购买房产,0
杰基·梅森：希拉里·克林顿不配当浴室服务员——她会偷厕纸,0
维基解密：电子邮件证明民主党操纵民意调查,0
朝鲜威胁称，如果该国继续支持ISIS，将对以色列发动“神圣”核战争,0
朝鲜威胁称，如果该国继续支持ISIS，将对以色列发动“神圣”核战争,0
这位前国会议员在推特上说，“如果特朗普输了，我就要拿起火枪。”,0
数百万也门人在“被遗忘的战争”中丧生,0
操纵初选、媒体和候选人；美国索具系统,0
吉达机场被安萨阿拉导弹袭击并被点燃,0
沙特国王有可能在美国法院受到JASTA法律的审判吗？,0
沙特国王有可能在美国法院受到JASTA法律的审判吗？,0
数百万也门人在“被遗忘的战争”中丧生,0
操纵初选、媒体和候选人；美国索具系统,0
吉达机场被安萨阿拉导弹袭击并被点燃,0
希拉里·克林顿向卡塔尔央行“突然出手”18亿美元震惊金融界,0
希拉里·克林顿向卡塔尔央行“突然出手”18亿美元震惊金融界,0
从今年年初开始，犹太复国主义政权已经摧毁了属于巴勒斯坦人的780所房屋,0
埃尔多安希望通过支持沙特阿拉伯来重振奥斯曼帝国的梦想,0
叙利亚总统巴沙尔·阿萨德欢迎总理兼国内贸易和消费者保护部长,0
在Al-Qatif指控两名年轻男子,0
沙特阿拉伯宣布适用增值税的确定日期,0
英国女王伊丽莎白二世拥有英国的每一只海豚，不需要驾驶执照，也不纳税——以下是你不知道的君主制所拥有的令人难以置信的权力,0
更多穆斯林虐待动物：巴勒斯坦人拍摄自己用水泥块和大石头砸死鬣狗的视频,0
很快，来到你附近的一个法国社区…7000多名非法的外国穆斯林入侵者在加莱丛林营地被关闭时放火焚烧了他们的营地,0
德国：叙利亚穆斯林入侵者高喊“真主保佑”扰乱教堂婚礼，摸圣母玛利亚雕像,0
PAT CONDELL：美国的最后机会…,0
德国：关于隔壁那个“友好的穆斯林家庭”…。,0
当一个美国穆斯林竞选政治职位时，他参选的唯一原因就是传播伊斯兰教。时期,0
特朗普的黑色VETERANS，太！,0
脸书纳粹思想警察编辑威胁说，如果马克·扎克伯格不禁止唐纳德·特朗普发表仇恨言论，他们将辞职,0
前联邦调查局特工兼反恐专家约翰·关多洛总是受到指定恐怖组织CAIR的攻击，他是培训执法人员了解伊斯兰教对美国构成的日益严重威胁的首选人选,0
德国：叙利亚穆斯林男孩团伙因性侵9岁女孩而被禁止进入游泳池,0
保加利亚：近1000名穆斯林白吃者因“糟糕的食物和延迟给予他们进入西欧的身份”而反抗,0
英国儿童保护服务机构的工作人员“害怕”挑战穆斯林入侵者的年龄，因为担心最终会上法庭,0
德国：德国小学“强迫”孩子在穆斯林祈祷中高呼“真主保佑”和“只有真主”，家长们对此感到愤怒,0
盖伊·特朗普支持者收到同性恋者的死亡威胁，他们支持一位从处决同性恋者的国家获得数百万美元捐款的候选人,0
颇具争议的英国评论员凯蒂·霍普金斯指责CNN主持人公然偏袒希拉里·克林顿,0
你去吧，女孩！英国第一的Jayda Fransen在一家清真肉店掀起了轩然大波,0
德克萨斯州：在乔治·索罗斯的电子投票机被操纵将特朗普的选票切换到希拉里的投票站索要一张纸,0
希拉里的（伊斯兰）美国已经在这里了，密歇根州各地都出现了“穆斯林无政府区”,0
巨大！维基解密终于打破了希拉里·克林顿的泡沫了吗？,0
嘿，加拿大人！最近有报道称，在德国的叙利亚穆斯林移民为他的四个妻子和23个孩子都获得了福利，你对此感到震惊吗？,0
操纵台在：扭曲的希拉里扭曲的投票机,0
