离婚窗口排长队,0
因应5/1劳动节和疫情影响，劳动部体恤劳工发放补助金5000元？恶作剧连结,0
4.11高雄街头枪战1死？误导贴文！影片为2018年警方围捕画面,0
深圳儿童医院创院院长冯雷教授寄语？高胆固醇食物代表高营养值？资深冠名谣言,0
美国在台设立10座实验室？实为美国生技厂在台经销商名单,0
甘草绿豆水能排疫苗中毒？解铅中毒？无科学依据！肾脏病或心脏病患者应注意,0
德国式预防措施？温盐水漱口终结了新冠病毒？误导影片,0
包装水的水源可以从瓶盖分辨？矿泉水蓝色、自来水白色？非台湾之规定,0
感染肺炎全都是食肉食鱼加辛辣的人？用浓茶治肺炎病？误导内容！缺乏研究根据,0
网传瑞士撤除对俄罗斯制裁？政策未变！内容并无事实根据,0
莫德纳公司制造新冠病毒？英国每日邮报报导？曲解媒体报导内容,0
俄罗斯60个城市爆发大游行要普京下台影片？2021年抗议活动片段,0
抹茶粉是蚕宝宝大便？抹茶的绿色来自茶叶的叶绿素,0
新冠病毒除名？不再以核酸检测阳性为依据？疫情年内宣告结束？虚构不实的内容,0
加拿大官方数据表明接种三剂疫苗会患上爱滋病？免疫不全？误导内容,0
车臣军冲进乌克兰亚速营总部发现红十字药箱装美金？挪用2018无关事件影片,0
这个菜根泡水喝让你远离肾衰竭？香菜生姜排毒水？别为了避免洗肾而误信偏方,0
塑胶杯盖小孔喝热饮，双酚A影响生殖新闻影片？医：错误解读,0
苹果这样吃让你10天瘦7斤？搭配生姜、绿豆的减肥方法？营养师详细解析,0
寻获东方航空黑盒子？坠毁前70秒的惊悚画面？挪用电影片段的误导影片讯息,0
网传牛排有虫的影片？还敢吃五分熟？刻意设计的片段！医师：建议熟食,0
俄罗斯今天传出反制裁台湾？关闭代表处、没收债券、禁飞等政策？内容缺乏事实根据,0
说乌克兰设计划面指控俄罗斯轰炸杀戮？会抽烟的尸体影片？挪用过去歌手MV拍摄花絮,0
乌克兰足球员上战场的照片？实为右翼民族主义团体Gonor合照，与足球俱乐部无关,0
威尔史密斯掌掴事件，众星的第一表情照片？2017年奥斯卡颁奖典礼旧照,0
六位失事班机的空服员？实为过去四川航空的照片！与中国东方航空MU5735航班空难无关,0
俄罗斯反战示威民众与警方发生冲突的影片贴文？挪用2021年旧事件片段,0
战争中的乌克兰消防员？实为2019年澳洲消防队员照片,0
乌克兰调查局抓到官员携带百万美元潜逃欧盟？实为2021年事件旧照,0
在乌经营音响店？导致音箱无法售出？诈骗购物贴文！辨识技巧与防诈观念学起来,0
临时有事下了飞机那位？活著逃过空难的影片？挪用不同时空片段的不实贴文,0
三月蛋荒，凌晨地震又让蛋商的鸡蛋掉落一地的图片贴文？实为2018年的照片,0
乌克兰已成功加入欧盟？尚处于入会申请阶段,0
俄罗斯跪迎殉难烈士回家影片？实为2015年乌克兰志愿军的葬礼仪式,0
教宗方济各有所行动？梵蒂冈外交官发表声明？实为前教廷驻美大使评论,0
中国东方航空737客机最后坠机画面曝光？2019年衣索比亚航空坠机模拟动画,0
俄罗斯总统说核武已对准美国影片？随时统一北约？假字幕误导！挪用2014年片段,0
草莓是百毒之首的水果？莓农说词不明或错误！专家详解,0
俄军攻破基辅市中心？泽伦斯基接受俄罗斯停火6大条件？网传影片描述与事实不符,0
解放军击落台湾战机？飞行员被押送回北京？虚构影片描述,0
乌克兰造假泽伦斯基探访医院影片？随行女军医早已被俄军炸死？画面中女性为不同人,0
德国在联合国的发言影片？实为德国联邦议院的特别会议，并非在联合国,0
辉瑞要下市了？永远合法地消失？曲解被收购公司的下市公告函,0
网传整个广东省将会全面封城的影片？实为深圳疫区画面,0
土耳其制无人机击毁俄罗斯坦克影片？2020年无人机袭击叙利亚军队事件,0
3月18日开始用生姜、红枣、红糖熬汤喝补阳气？中医师：当心可能因此补错了,0
乌克兰妇产医院遭轰炸是自导自演栽赃俄军？孕妇是演员？传言说法皆为虚假描述,0
印度航空一航班勇敢飞越乌克兰上空？图片与实际飞行路线不符,0
用自制鸡尾酒毁坏俄罗斯坦克的影片？实为2014年于乌克兰示威片段,0
描述无助的乌克兰人是一场戏的影片贴文？挪用2016年于英国的电影拍摄场景,0
泽伦斯基的衣服上印有纳粹符号照片？图片经过编修变造,0
普丁威胁用核武回击美国与北约的影片？假字幕翻译与事实不符,0
全球最大汽车制造商丰田重返俄罗斯市场？已暂停在俄生产设施营运,0
去超商买鸡蛋？核蛋有写日本自动化洗选工厂？包装产地标注警语？误导描述,0
媒体对俄罗斯报假新闻？雇用乌克兰人涂假血影片？误导的虚构说法,0
俄罗斯使用真空炸弹摧毁乌克兰军事基地影片？挪用2019年旧画面,0
乌克兰车队被俄罗斯士兵袭击的血腥影片？2015年亲俄反叛军杀害乌克兰俘虏画面,0
乌克兰防空武器防御俄罗斯战斗机空袭影片？电玩游戏画面非实际情况,0
日本核蛋来啰的图片？近日尽量不要到大型卖场买鸡蛋？误导描述,0
乌克兰吊死乌东民兵和其怀孕妻子的影片？2015年谣言影片误导,0
面条添加这么多磷酸盐？很多人肾坏、肝硬化、癌症上身？勿过度解读,0
网传111年1月28日酒驾法律已修改并即日施行？律师详细说明,0
网传不到3岁的乌克兰小孩头破血流照片？欧洲领导人见死不救？实为2018年叙利亚战争旧照,0
CNN记者死两次的图片讯息？主流媒体造假？虚构不实的社群贴文,0
六月以后打满三剂返台免隔离图片？错误标语非现行防疫政策,0
世界最长寿土耳其399岁的老人影片？实为109岁的泰国长者,0
FDA败诉？辉瑞被迫公开疫苗数据？副作用上千种？曲解不良事件通报,0
网传勇敢的乌克兰小女孩骂跑俄罗斯军人的影片？2012年巴勒斯坦女孩和以色列士兵对峙,0
乌克兰总统泽伦斯基演唱的Endless Love影片？错误描述！美国摇滚乐团Boyce Avenue,0
乌克兰车队遭俄罗斯部队袭击影片？游戏画面非实际战争状况,0
乌克兰电视台造假阵亡人员的报导影片？挪用环团抗议影片误导造假,0
两名乌克兰儿童正在派遣士兵与俄罗斯人作战照片？此旧照与近期乌俄战争无关,0
网传剧中唱歌的是当今乌克兰总统？影片中主角并非泽伦斯基,0
网传乌克兰总统泽连斯基上前线的照片？旧照并非近期画面,0
网传乌克兰民众在雪中跪下祈祷的照片？2019旧照非近期状况,0
一天干掉六架战机的基辅之鬼出现的影片？游戏影像并非真实场景,0
俄罗斯导弹很准 只有打军事重点不打民宅的影片？2021年5月影片,0
乌克兰最新情况？俄罗斯坦克入基辅影片？2014年片段！无关俄乌军事冲突,0
俄罗斯导弹袭击乌克兰基辅的影片？实为2021年以巴冲突画面,0
俄乌激战电视看不到的画面影片？非近期事件！多年前片段,0
网传俄罗斯攻击乌克兰多个城市战争轰炸影片？实为电玩游戏画面,0
普丁将推迟入侵，直到拜登向乌克兰运送武器的图片？图片文字经过窜改,0
网传乌克兰击落俄罗斯战机的影片？2011年利比亚战机被击落画面,0
网传基辅一处发电站遭到轰炸的影片？2015中国天津港爆炸画面,0
乌克兰首都遭空袭画面？俄罗斯飞机飞越乌克兰上空的影片？2020年片段非近期事件,0
俄罗斯伞兵入侵乌克兰影片？挪用多年前不同事件的片段,0
乌克兰击毁俄罗斯战机成「空中火球」照片？挪用1993年航展事故照片,0
乌俄战争开战首日飞弹空袭画面影片？误导描述！挪用不同时空片段,0
网传刘若英先生钟小江出身中医世家的养生文章？冠名内容且多处错误,0
喝太多饮料导致白血病？饮料中的甜味素将骨髓的网堵塞？无根据说法,0
小孩看手机8个小时以上造成视网膜动脉阻塞的影片？小孩发生机率少,0
英国女王伊丽莎白二世过世的消息？缺乏可靠资讯来源！不明社群帐号内容,0
俗称黑甜菜的龙葵是杀癌高手？还能降血压护肝脏？当心中毒风险！务必征询专业医师治疗,0
乌克兰幼儿园炮火击穿的照片？舆论战？流传图片应为后制合成,0
全联福利中心送福利？填问卷拿10000元礼品卡？钓鱼网站！切勿点击转发讯息,0
网传「颈椎粉碎机」的错误运动姿势？伤害颈椎、腰椎及膝关节？勿过度解读,0
辉瑞与强生疫苗中发现九头蛇寄生虫的影片？无根据说法,0
澳大利亚殡仪馆主任揭示了疫苗造成的大量死亡婴儿死亡？无根据说法,0
这是台北车站？游民睡在那里，帮助他们的居然是越人的影片？,0
网传部分辐射污染地区输台食品列表？资深谣言图片误导,0
Costco 40周年庆典礼物讯息？填问卷拿奖金？冒名钓鱼网站！切勿填写个资,0
现在外公、外婆都不能叫了？连续剧外婆的澎湖湾被迫改名？释义加注相关政策厘清,0
辉瑞前总裁现身曝光疫苗真相的影片？影片中人物并非辉瑞前总裁,0
只要扫实联制，就有机会中14天隔离大礼包？被迫住进需自费的防疫旅馆？相关政策厘清,0
早起意味著中风，甚至提前死亡的影片？易诱发糖尿病？各科医师详解,0
淡水瓜隧道？宜兰壮围乡休闲农场瓜隧道影片？实为屏东热带农业博览会,0
世卫组织发出警告？这种绿叶菜肝肾还致癌？蕨菜、红凤菜、槟榔？影片部分说法无根据,0
坎培拉自由车队兼人民反强制大集会的照片？实为2019英国表演艺术节,0
高雄市卫武营国家剧场演出纯台湾味的影片？影片发生于美国佛罗里达州,0
专家分析Omicron为何传染性会高、但症状轻微的讯息？再变种的病毒会更强？医师详解,0
普京豪言震惊西方？俄罗斯没有了，还要这个世界干什么？误导描述,0
CNN报导美国移民局要谷爱凌立即回国接受审判？媒体并无此报导,0
欠缺资料？假的DHL追踪货件包裹简讯！骗信用卡钓鱼网站，切勿输入个资！,0
西班牙农民加入加拿大卡车司机抗议活动？已开始封锁安达卢西亚A4高速公路？误导描述,0
难得拍到神舟13号太空人在太空漫步的影片？动画制作非实拍画面,0
加拿大卡车司机抗议疫苗强制影片？德国农民们支持片段？挪用无关事件之影片讯息,0
强制疫苗后美军各种疾病发病率剧增？美军已澄清相关数据并不准确,0
北京正式宣布取代人民币的货币出炉？兑换美元比例1比1？无根据说法,0
国际法院下令全球停止接种COVID疫苗？辉瑞等高级官员犯下危害人类罪？无根据说法,0
疫苗后遗症逐渐涌现？半年来多达108足球员死亡是过往平均的5倍？无根据说法,0
这14天全家便利商店都不要去？因物流公司染疫？勿过度解读讯息,0
刚好遇到禽流感所以鸡被扑杀好几万只？因为缺蛋鸡被下很重的药？缺乏背景说法,0
以下国家宣布取消所有检疫程序？盐水漱口清除病毒？混搭谣言,0
网传苏联攻击乌克兰上空炮火连天影片？流传片段为2003年巴格达空袭画面,0
墨西哥政府免费为其公民提供的伊维菌素包的图片？该单位已停止该政策,0
打疫苗前后人体内发炎反应图解读？打第三针快凉了？不同脉络图片拼凑,0
日本在冠状病毒疫苗标签增加心脏炎症警告文章？日本查核组织与专家详细解析,0
昨日美国费城市中心商业广场双子塔发生大火的影片？2022年1月费城火灾事件,0
宜兰县新冠病毒确诊分布讯息？过期内容！务必各县市官方与指挥中心发布资讯为主,0
世界卫生组织对Covid-19疫苗升起白旗？现在的疫苗不会产生任何作用？无根据内容,0
欧洲多国终止疫苗护照？国际刑事法庭立案调查COVID-19疫苗？部分内容与事实不符,0
疫苗竟不防重症？英国苏格兰官方数据打脸？传言说法和原始报告不符,0
台湾养殖三种重大用药的鱼种 ？午仔鱼、石斑鱼、乌鱼？渔业署澄清用药养殖传言,0
美国通货膨胀物价高涨，人民在卖场抢物品影片？挪用2021非动乱事件,0
喝白酒防新冠的影片？要50度以上能防新冠病毒？错误描述,0
正义的韩国医生揭露冠状病毒疫苗里的怪异生命体？缺乏根据，韩国有关单位驳斥,0
网传今年三月开始夜间弹性限电的公文？为电费减免回馈自选措施,0
第3剂疫苗是消耗库存疫苗政策？对防Omicron没用？讯息脉络,0
重磅8分钟影片？前世卫组织副主席欧盟会议说疫苗完全无效，不能防止传染与重症？部分说法并非事实,0
一个鸡蛋这样吃让你一辈子远离中风？影片内容过度推论，专家详细解析,0
网传东加海底火山爆发最后影片画面？电脑模拟动画,0
美国FDA正式宣布辉瑞新冠特效药？Paxlovid可在药房里买到回家服用？部分说法非事实,0
有人触电后被电死10到15秒，用棍子打脚底就会复活？无根据说法,0
美国高院停止疫苗强制令？英国1月底前停止强制令？传言叙述多处错误,0
不戴口罩照片不要上传FB，一个人罚6万？未依规定配戴口罩罚则实为3000至15000元,0
印尼航空Garuda在伊朗马什哈德降落的一幕？虚拟影片非真实场景,0
喝消毒水？服用或吸入二氧化氯抗疫苗中的氧化石墨烯毒素？危险！当心误导贴文,0
德国最新研究？打3剂新冠疫苗形成爱滋病？无根据说法,0
德国开第一枪？未来地下停车场将不可停放电动车？仅为过渡措施现已取消,0
接种过疫苗的更容易感染Omicron的影片讯息？错误说法,0
网传Type-C充电线烧焦的影片？金属接点外露的风险？专家解析,0
麻州综合医院国际传染病主任爱德华·瑞恩MD通话的说明？误导内容,0
美国集装箱装尸？这就是美国的民主？影片挪用戏剧画面，非真实事件,0
过年市场休市，连休11天？储存粮食？并没有这样的公告,0
mRNA疫苗技术发明者罗伯特马龙博士的影片讯息？儿童接种疫苗的风险远超过好处？,0
美国城市新闻网邀请包炜医学博士解析Omicron病毒？专家解析,0
手机充电时在讲电话切记不能喝水？会倒电入心脏？设计过的情境剧,0
今天开始10天台湾正式进入Omicron关键期？过去流言改编,0
以色列摩萨德和美国联邦调查局发现麦当劳使用人肉的证据？无根据说法,0
德国96%感染都是接种者？显示打针更易感染？并无网传宣称之数据,0
返台住防疫旅馆的朋友？剑潭的青年活动中心环境状况？与实际状况不符,0
台北的人要心理有准备Omicron大感染了？个人观点搭医师提醒贴文,0
戴口罩缺氧综合症现已席卷全球 ？高碳酸血症？传言原文说法多处错误,0
麦当劳与厨师杰米·奥利弗的官司败诉，证明食物有剧毒？国际流言且无此诉讼,0
钙质与蛋白质的斗争？蛋白质过量会骨质疏松症？营养师详细解析,0
简单辩识有瘦肉精的猪肉？正常会有五公分厚的肥肉，瘦肉精猪则没有？无法以肉眼判断,0
英国殡葬业者的心声？死亡案例超过过去14年的总和？传言影片叙述多处错误,0
身分证遗失花3分钟，保护自己权益的重要常识讯息？可透过网路或电话挂失,0
车子要装行车记录器不然罚钱？法规主要针对大型车辆，一般小客车未强制,0
网传桃园市防疫再升级的图片内容？2021年的社群宣导图卡,0
美国的零元购？大尺寸的液晶电视直接劫走？2020 年芝加哥事件,0
日本研发的视力恢复训练影片？眼睛舒服多了？无科学根据且无法改善视力,0
这是昨晚北京的烟火？传统与5G？台湾落后大陆非常多？青岛电视塔AR特效影片,0
澳大利亚有人这么抗议：反对将奥密克戎和德尔塔「种族隔离」标语？应为后制图片,0
美国葛兰素公司研制成功24小时均可使用的鼻腔口罩？撷取各厂商之影片,0
英国卫生局数据指出？只有完全接种疫苗的人才会得到Omicron？计算方式错误,0
谭德塞承认一些国家使用疫苗杀死儿童的影片？误导说法,0
吴念真办公室遭检搜索关于入联公投的图卡？拼凑多则不相关旧闻,0
因为城中城火灾现在高雄市政府有一个德政，免费警报器的真实讯息,0
网传中国稀土注册地改新疆的图卡？缺乏背景资讯的无根据说法,0
12月24日中国宣布反制？所有口罩中加入新疆棉花？无根据说法,0
自救坐骨神经痛的影片？当心症状加剧！务必寻求专科医师协助,0
猪肉加工品大多使用莱猪？买猪肉没有猪皮的都是莱猪？无法直接依猪皮来判断,0
揉腹治便秘、胃病？太谿穴补肾气、断生死？中西医师解析,0
PCR筛检把普通感冒诊断为新冠阳性？检测经综合考量，误检其他细菌病毒可能低,0
蔡政府官员民代们围绕著美女辣妹？高雄市经济发展协会晚会活动？民间单位举办之活动,0
COP 26共识将核电重新定位为绿能？葛罗希指出核电重新受人重视的五项原因？错误解读,0
面粉掺增筋剂，多食易致癌新闻影片？过氧化苯甲醯和偶氮二甲醯胺议题,0
超级可怕的民进党为了一个公投无所不用其极，请客吃饭上百桌影片？郭信良之友会联谊活动,0
农委会上星期五已经偷偷通过？养猪业者也可以使用瘦肉精？国内并未核准使用,0
德国专家揭发疫苗里含有氢氧化石墨烯后遭谋杀？死因为心脏病发,0
比尔盖兹救地球让阳光变暗？高空喷洒碳酸钙防暖化？网传说法具误导性,0
印尼弗洛勒斯海发生7.3级强震的影片？2018年阿拉斯加地震画面,0
抗氧化食物数值一览表？可预防癌症、糖尿病并发症？部分缺乏实证的资深传言,0
公投不去投票，就等于是不同意票？误导描述内容,0
新兴毒品「金刚」咖啡包装照片？脉络查证与警方说法！勿接受不明的饮料或食物,0
三十万日本侨民被取消签证？首相致电北京要求商议被秒拒绝？虚构内容,0
经常吃豆腐乳的好处？有高血压和胆固醇的人要常吃？当心钠含量！营养师解析,0
中国央视表态公投四个同意的图片？原始节目并未有此论述,0
三天前爆发过后的印尼东爪哇省塞梅鲁火山影片？后制片段与误导描述,0
比尔盖兹投资在基因架接的疫苗已遍及全球？超级天花病毒？缺乏根据描述,0
德国超市用栅栏将打过疫苗和没打的人隔开照片？流传图片非德国,0
美国政府国土安全机构通知？有人在eBay购买UPS送货员工制服？资深谣言,0
郭台铭上周日在新店行道会，由张茂松牧师为他受浸的影片？误导描述,0
现场实拍印度国防参谋长直升机坠毁过程？挪用叙利亚直升机遭击落之影片,0
最新台中大里枪战现场影片？诈欺公司黑吃黑？波多黎各的街头枪战画面,0
好市多线上购物脸书粉丝专页？Costco的免运费免代购？当心一页式诈骗,0
请外佣照顾子女的悲哀？打婴儿的影片？2019年流传的不明背景片段,0
辉瑞高管承认设计疫苗不是为了终结大流行，而是将其变成流行病？误解原始说法,0
花椒水泡澡泡脚可以把乳癌肿瘤缩小？让痘痘消失？中西医详细解析,0
日夜奔驰一带一路九十节的中欧班列过程画面？实为火车模拟动画,0
张忠谋董事长看不下去？呼吁国民党不要再闹了？并未回应公投问题,0
死于COVID疫苗的儿童数量多于死于病毒本身的人数？无根据说法,0
帮同学超商领东西被查获是领毒品？3名警大生被开除学籍？与原始事件不符,0
疫苗小瓶上的代码？医学中心资深护士展示秘密的影片？错误说法,0
佛奇正在策划一种新的禽流感病毒的影片？网传叙述与实际状况不符,0
虐童案的影片？继父被网友集结吊起来私刑？2019年不同事件画面,0
肝胆权威院长罹患肝癌病逝？癌症病患均属酸性体质？拼凑改编谣言,0
未接种疫苗的人并不危险，已接种的人对其他人构成危险？多为错误说法,0
将溺水的孩子倒吊背著跑就能救回一命？消防署与医师详细解析,0
新东阳、黑桥牌猪肉制品被香港查获莱克多巴胺超标数十倍？相关报导与查验脉络,0
脸书社团买二手商品，要求私讯并用LINE Pay先付款？诈骗得手就封锁！,0
新的COVID-Omicron变种冠状病毒是致命和不容易正确检测的？改编旧讯息，目前并无根据,0
口罩用前晃一晃的影片？环氧乙烷残留？市售医用口罩「未灭菌」毋需担心残留,0
一个人最有生产力的年龄是60到70岁？新英格兰医学杂志并无该项研究,0
黑人和白人男子开枪犯罪的保释金刑罚比较图片讯息？遗漏一事实,0
大蒜塞进耳朵里10分钟可以缓解头痛？缺乏根据！医师：严重恐危及性命,0
日前马斯克发布一段智慧型手机概念影片？无背景根据说法,0
奶奶86岁像20多岁？祖孙三代的影片？实为64岁,0
饭店来电说订房操作失误多订？要退刷或到ATM退款？挂掉电话立即向原饭店客服联络,0
保温杯突然爆炸致23岁女孩眼球破裂的影片？物理教授解析,0
加拿大完全接种疫苗的母亲6个月内死产86例？缺乏根据内容,0
说网购未取货要告你恶意拒收？威胁要求赔偿？别汇款！消保官：新型诈骗手法,0
公教人员退休金砍已退休人员的退休金来补？不实资讯拼凑内容,0
德国总理梅克尔的最后一次下班，情不自禁地舞蹈？喜剧节目片段,0
联合国宣布日本冲绳主权归中国？改名琉球？虚构影片内容,0
141岁药王：睡前拍打一处，拍掉100多种疾病的影片？夸大说法,0
网红艺人代言投资管道？简单操作超好赚？冒名影片广告！本金拿不回来,0
新的 Facebook／Meta 规则明天开始？无此新规则！资深谣言改编,0
美国总统川普昨天进行了下届总统期中竞选演说？并非真实演说内容,0
滑冰锦标赛上的失明男舞者表演影片？该选手并无失明,0
塔利班修美军破损直升机的影片？有人在直升机上旋转？电脑动画制作,0
艾丽莎·卡森将是登陆火星第一人的影片？不再回到地球？误导贴文描述,0
高一历史课本教日本是我们的母国？课本描述为当时背景之指称,0
明星流落街头影片？名人多天治疗没有结果？恶质内容产制行为与内容农场生态,0
冰岛的瀑布上形成的最美丽的圣诞树的图片？实为中国林州市结冰瀑布,0
台湾人持打2剂AZ疫苗黄卡却不能进入日本？入境标准为PCR检测阴性证明,0
伊朗的两个影片？三位抢劫珠宝店并杀害主人，伊朗政府在门外吊死三人？不同事件拼凑,0
亲人往生请办限定继承而不是只办抛弃继承？已修法为全面限定继承,0
阿里巴巴发布云电脑「无影」，全像投影且取代传统电脑？部分描述与实际状况不符,0
散光恢复法的影片？每天4次的训练？医：网传方法无效,0
长寿不在于运动，而在于静养的影片？一辈子心跳次数是有限的？多为错误说法,0
中国政府向全世界发布最新庄严公告？网传描述与实际内容不符,0
人才招募转职服务？征高起薪行政外汇助理？却要你操作虚拟货币，诱使进入假投资诈骗圈套,0
新冠疫苗微粒脱落？与疫苗接种者有密切接触的人发生心包炎、带状疱疹？缺乏根据论述,0
会喷火的鸟在澳洲被发现？森林大火是牠的杰作？剪辑影片误导,0
2021年11月9日下午5点左右 ，嘉义梅山太兴 ，万鹭朝凤？2019年影片,0
新冠疫苗导致子宫癌增加20倍？降低T细胞免疫力？多为错误说法,0
鸡蛋跟青椒一起炒堪称补钙之王？提高钙质吸收率？营养师解析,0
高雄卫武营国家剧场演出的纯台湾味影片？挪用毕业公演作品片段,0
香蕉有虫？来自索马里的500吨香蕉运抵市场含有螺杆菌的蠕虫？国际谣言误导内容,0
义大利卫生部将新冠病毒死亡人数从130000以上向下调到3783宗？误解原始报告数据,0
美国佛罗里达州特斯拉电动车电池爆炸影片？2020 年车祸事故,0
联合国近期以177对16票否决台湾加入联合国的议案？虚构影片讯息内容,0
中国布阵解放台湾？集运大量两栖坦克照片？征召军人通知简讯与文件？误导图片讯息,0
凌晨时分25个国家同时宣布提高台湾的旅游危险等级图片讯息？误导图文,0
以色列研究打辉瑞疫苗者的「确诊染病率」比未接种者自然免疫力者「高27倍」？专家解读研究,0
继西航空，达美航空首席执行官宣布他们将放弃对员工的强制疫苗注射？误导描述,0
这些东西吃药之后千万不能吃影片？吃胃药不能喝醋？吃中药不能吃柿子？专家详细解析,0
