离婚窗口排长队,0
哈工程教学楼地下有数门“超电磁炮”,0
薯片胀袋是变质了,0
成本只要1毛钱的人造鸡蛋泛滥,0
隔着玻璃晒太阳能补钙,0
安徽颍上县民政局“离婚队伍排到门外”,0
剩菜要等凉了再放冰箱,0
保温杯泡茶有毒还致癌,0
服用药物后对开车没有影响,0
长期吃汤泡饭养胃,0
油越多，类胡萝卜素越好吸收,0
输液会导致“湿气重”,0
央视春晚在四川蓬溪设分会场,0
草莓是最“脏”的水果,0
今年1月不认证停发养老金,0
合成维生素C可替代天然维生素C,0
呼和浩特一超市内有人拐孩子,0
上海民用电费涨价了,0
受伤后不能吃“发物”,0
“手指尖放血疗法”可以治疗急性心肌梗死,0
上海要调整“单炉单人”火化方式,0
西宁12月未进行资格认证将停发养老金,0
黄桃罐头全是防腐剂,0
网红“进口盐”更健康,0
代糖可以敞开吃,0
让宝宝喝“婴儿水”有助于生长发育,0
天然食品添加剂比人工合成更安全,0
智能电表“被加速”,0
磁共振有辐射,0
“零添加”食品更好,0
北京小客车指标2023年4月将过期,0
食品添加剂致性早熟,0
辐照食品会使食品中的营养物质流失,0
橘子分公母，母橘子更甜,0
片剂嚼碎了吃效果更好,0
碳酸钙牙膏是伤牙牙膏,0
用铁锅炒菜可以有效补铁,0
“三重”拉尼娜带来三倍寒冷,0
冬天热车越久越好,0
柿饼上的白霜是防腐剂,0
退休人员能领取医保一次性差额补贴,0
患了膝骨关节炎不能运动,0
总用一款牙膏会产生耐药性,0
这种水果服药期间可以吃,0
水果越甜含糖量越高,0
食补胶原蛋白能延缓皮肤衰老,0
电子烟是传统香烟的安全替代品,0
嚼槟榔，能养生,0
只要有云就能人工增雨,0
吃辣可以减肥,0
近视的人不会老花,0
“囤肉”可抗寒,0
运动的越多，身体越好,0
长期喝纯净水会缺钙,0
10月17日“四川利州超市疯狂抢购”,0
骨质疏松 补补钙就好了,0
打胰岛素有依赖性,0
棕榈油会促进癌症转移,0
可通过淄博预防接种中心电话预约HPV疫苗,0
清洗海鲜易感染“食肉菌”，且无药可救,0
橄榄油有益健康可以任性吃,0
炒菜时早点放碘盐,0
“鱼疗”可以治脚气,0
吃大豆会性早熟或致癌,0
白米饭是“垃圾食物之王”,0
阻生智齿应该尽早拔除,0
吃秋葵降血糖,0
“无菌蛋”没有细菌，可放心生食,0
牙膏会产生“耐药性”，要经常换,0
喝汽水能解酒,0
蚝油吃多了会致癌,0
“十年鸡头赛砒霜”，吃鸡头会重金属中毒,0
做手术就可以长高,0
经常吃含酵母的食物对身体有害,0
经常吃含酵母的食物容易得胃病,0
水果烂了一点可以吃,0
眉毛越长，寿命越长,0
吃饭时喝水会稀释胃液,0
食物放冰箱放多久都不会坏,0
吸烟不入肺对身体无害,0
水痘是儿童才会得的疾病,0
吃“冷米饭”等放凉的主食能减肥,0
喝热水能提高代谢,0
睡梦中“虎躯一震”是猝死的信号,0
年龄越小戴牙套效果越好,0
冷热水掺着喝会身体不适,0
吃枇杷能止咳,0
四川都江堰市近日发生山体滑坡,0
天津滨海新区来了一批人贩子,0
牛奶保质期长是因为加了防腐剂,0
杭州西湖断桥边劫持人质突发事件,0
水果当饭吃，饱腹又减肥,0
无锡有H7N9病亡者，大家暂时别吃鸡肉,0
西安桃园北路高架桥坍塌,0
牙膏能“促长牙”“补牙洞”,0
世界卫生组织提醒：尽早停止使用微波炉,0
喝可乐能解酒,0
先吃水果再吃饭更利于营养吸收,0
蚊子包越大毒性越强,0
“睡眠惊跳”对睡眠质量的影响没法改善,0
反季水果不健康,0
食品添加剂都不能吃,0
“洋”蔬菜比普通蔬菜营养价值高,0
“上海白蚁”冲上热搜，白蚁就是白色的蚂蚁,0
脱发与吸烟无关,0
仰头玩手机可以预防颈椎病,0
展示IP属地会泄露隐私,0
加碘盐会导致甲状腺结节,0
豆浆喝多了会诱发乳腺癌,0
吸烟不会导致皮肤老化,0
饮用牛奶会导致未成年人性早熟,0
长期喝牛奶会导致乳腺癌,0
维生素D补得越多越健康,0
自热米饭里的大米是假的,0
打性抑制针可用于增高,0
城市地下水位越高越好,0
将双腿抬高，能让心搏骤停者恢复心脏跳动,0
使用空气炸锅会致癌,0
验钞手电筒能检出食物中的黄曲霉毒素,0
金针菇含甲醛,0
看B超单上孕囊的数据，可以提前知道宝宝性别,0
不换三代社保卡影响待遇发放,0
负压病房会让患者呼吸困难,0
糯米做的食品都不好消化,0
有人吃杨梅感染SK5病毒死亡,0
三大通信公司合并，转发有奖金,0
口罩、棉签里含石墨烯，会危害健康,0
东西向睡觉会导致失眠,0
吃8424西瓜感染禽流感,0
“过午不食”有助于减肥,0
喝水可以补钙？,0
常喝“硬水”易患肾结石,0
食用金箔是高端添加剂对身体有益,0
草莓是“百毒之首”的水果,0
光的颜色对眼睛健康没影响,0
吃完饭不能松裤腰带,0
孩子生病后打针“好得快”,0
锻炼，能够抵消熬夜的伤害,0
服用黑芝麻丸能够预防脱发,0
花滑运动员天生转圈不晕,0
老年人每年输一两次液能通血管,0
干眼症就是眼睛缺水,0
孩子床头放柠檬，能帮助长高,0
自酿酒、纯粮酿造的酒更健康,0
冬奥会是冰雪运动的竞技，所以天气越冷越好,0
“大便移植”能治自闭症,0
叶酸只有孕妇才要补,0
体感寒冷只是因为天气冷,0
布洛芬真是万能止痛药,0
食疗代替降糖药物,0
隔空充电有辐射危险,0
酒后头痛，来片止痛片,0
合成色素有害健康，不能用于食品,0
北斗卫星导航系统会频繁掉线,0
2022年春节期间快递停运,0
冬奥期间天然降雪越多越好,0
醋吃多了会导致骨质疏松,0
宝宝穿纸尿裤导致O形腿、红屁股,0
血稠容易堵塞血管,0
虾和水果同食会产生砒霜,0
核能供暖的热水带有辐射,0
奥密克戎变异株能躲避新冠测试，感染的人检测不出来,0
口罩消毒残留物会致癌，用前要抖一抖,0
撞树锻炼可以强身健体？,0
12月30日成都一辆汽车在行驶途中发生爆炸,0
2022年1月1日起推迟办车辆年检将被锁定档案,0
有“熊猫眼”，一定是熬夜的锅,0
眼科OCT检查是照CT,0
睡硬板床，真的对腰椎有好处,0
越酸的水果，维生素C的含量越高,0
石家庄7名顾客因食物中毒死亡,0
眯眼看世界，更能看得清,0
营养不够、免疫力低，输点“白蛋白”就没事,0
血型还能决定寿命长短,0
华侨大学停办,0
肥胖真的会导致血管“流油”，可以通过透析去掉,0
水果吃得越多越好 饭后吃有助于消化,0
看绿色可以保护视力,0
糖尿病患者不能吃米饭、馒头、面条等碳水化合物食物,0
疼痛不是病，能忍则忍,0
超市大米不生虫是因为加了防腐剂,0
鱼子酱以国外产的质量为佳，国产鱼子酱不如国外质量好,0
很多野生动物长得很萌且不伤人，可作为宠物在家饲养,0
葡萄价格越贵的越有营养,0
火鸡比普通鸡贵，肯定营养价值更丰富,0
胆红素偏高就是肝有问题,0
未开封瓶装矿泉水中有蛆虫,0
常吃米饭易诱发肝癌,0
低温会导致脂肪囤积，穿的越少越容易变胖,0
香蕉里面有蠕虫,0
吃瓜、玉米能降血糖,0
吃含有酵母的食物会导致胃病,0
装了心脏支架不能做核磁检查,0
“三高”人群不能吃蛋黄,0
银杏叶泡水喝能降血压,0
用蔬菜水冲奶粉可以防止小孩上火,0
电池充电要充到100%，对电池更好,0
补维生素能预防心脏病,0
口服避孕药导致血栓,0
关节炎是冻出来的,0
喂加药饲料“人造”双黄鸡蛋,0
被毒蛇咬了能用嘴吸毒液救命,0
止痛药吃多了，会上瘾,0
甘肃省定西市临洮县发生8.3级地震,0
海鱼没有寄生虫，可以随便吃,0
长期吃隔夜菜致重度贫血,0
被针扎到就会传染艾滋病毒,0
社保卡只能在户籍地办理,0
白内障要等到“熟透”了再做手术,0
暴雨后城市自来水不能喝,0
长期熬夜能长出老年斑,0
雷雨天手机会引雷,0
洗衣液加84能增强消毒效果,0
闭眼休息可以避免干眼症状的发生,0
吃大蒜能治疗HP,0
溺水抢救只需人工呼吸,0
有睡眠障碍可以服用褪黑素,0
扭伤都可以用红花油治疗,0
成年后能够再次长高,0
只要按时杀毒，电脑就不会被安装木马程序,0
中年睡得少，老年易痴呆,0
大量出汗能排出体内毒素,0
空调除湿模式比制冷模式更省电,0
根据房间温度随时开关空调可以节省电量,0
能燃烧的粉丝是塑料做的,0
味精是化学合成的有害物质,0
剃成光头就不会有头皮屑,0
维生素有益健康 多多益善,0
止痛药能缓解所有疼痛,0
睡硬板床可以帮助减轻腰痛,0
夏季要避免出汗,0
O型血的人最容易被蚊子叮咬,0
少食多餐更健康,0
吃苦瓜可以降血糖,0
减肥应该严格控制脂肪摄入量,0
孩子总生病是因为抵抗力差,0
孩子长得快是好事,0
鲜浓的肉汤比肉更营养,0
为保证营养吸收，应先吃水果再吃饭,0
基因检测可用来检测孩子的天赋,0
骨质增生是补钙补多了,0
选择中医治疗冠心病就不需支架介入,0
小孩胖点才好,0
晚说话的小孩更聪明,0
突然戒烟反伤身,0
儿童腹泻不应吃东西,0
接种冠状病毒疫苗后打麻药会导致死亡,0
儿童接种流感疫苗，不仅没用还有风险,0
儿童夜里磨牙是因为肚子里有蛔虫,0
美白牙膏能让牙齿变白,0
胰腺炎是很多成年人才会患上的疾病,0
纸尿裤易导致O型腿,0
视力低于1.0就是弱视,0
心脏病就是冠心病,0
复原乳是假牛奶,0
荧光剂不安全,0
碳水就是碳水化合物,0
多抽烟最多只会得肺癌，而不会得胃癌,0
只有年纪大的人才会得大肠癌，年轻人不会,0
扁豆会损害肝脏，不能吃,0
房车上路不存在超员一说,0
接种疫苗将致病毒“免疫逃逸”,0
4月1日定为消防战士纪念日,0
吃蒲公英能治疗甲状腺瘤,0
“泡药沃柑”果农从来不吃,0
颈椎病发作，撤掉枕头平躺睡几天就好了,0
爱吃辣的人更易得老年痴呆,0
杭州中考有重大变化，重高名额分配提到65%,0
不出国就可拿海外文凭落户上海,0
成都天府新区恢复原来楼市限购政策,0
银行将全面暂停房贷，买房不能贷款了,0
河北省应急管理厅招聘应急救援人员,0
非法社会组织大量存在是因为登记门槛高,0
无需出国就可获海外文凭,0
汕头60岁以上可拿社保卡去邮政银行领医保补贴,0
睡觉时总感觉一脚踩空是疾病前兆,0
人体不同器官到了夜间有固定的排毒时刻,0
老人鞋越软、越防滑越好,0
今年海口扫墓要摇号,0
河省教育厅向学校推销书籍,0
肾不好=肾虚=性功能差,0
钙补多了易得肾结石,0
4月1日后住房贷款利息将上调,0
长沙小升初招收艺体特长生,0
蒲公英可以治疗肝炎,0
生理期更容易减肥,0
昆山一网友扶摔倒老人送医被讹,0
吃素的人不会患脂肪肝,0
“一孕傻三年”是麻药惹的祸,0
养老保险关系跨省转移只转个人部分，单位缴费部分不转移,0
国家突然成立中医委,0
“日凌”会对电视和人体造成危害,0
医保账户介于5月份取消，今年医保不打钱了,0
喝红糖可以补铁,0
花600元“包办浙A区域号牌”,0
喝热水能治百病,0
哮喘的孩子不能参加体育活动,0
聊天发早安图片要收费,0
吃苦胆可清热解毒降低血糖,0
经常吃腐乳会致癌,0
赴韩签证全面放开了,0
洛阳地铁招聘安检人员,0
肾结石不痛不用处理,0
某网民称“代理共青团中央公号发稿”,0
教育部发布改革预案，中考往届生将不复存在,0
“男女延迟退休年龄表”公布,0
麻醉药七氟烷“一捂就晕”,0
3月1日起，定期存款利息将跟活期一样,0
吃猪肺可以预防肺癌,0
角膜塑形镜能矫正近视,0
个别人员称可代办签证,0
高血压能根治,0
领取元宵节补助紧急通告,0
酒后小区停车场驾车不算酒驾,0
四川绵阳将进行2021元宵烟花预演,0
冠心病的痛就是胸痛或者心前区痛,0
赤砂糖是红糖,0
网上可预订北京环球影城内部票,0
广西桂林：带200元到棋牌室就算赌博,0
京小升初招生“抢跑”,0
足球正式纳入2021年全国中考考核项目,0
越剧烈的运动就越燃脂,0
压榨的食用油比浸出的好,0
服用降压药能够平复情绪,0
腊肠、腊肉会致癌,0
全国第七次人口普查结果出炉,0
上海市房管局出台了新的楼市调控政策,0
河北省社保局要求退休职工必须在1月底完成生存认证,0
不含胆固醇的植物油更健康,0
拍打胳膊肘能祛除体内湿气,0
白天使用含VC化妆品皮肤会变黑,0
吃蕨菜一定会致癌,0
社保卡可以用来换钱,0
钙补多了肾结石,0
嘴唇干裂多喝水就能复原,0
风湿病都和天气有关,0
免洗洗手液可以完全替代流水冲洗,0
喝酒脸红代表酒量大,0
味精加热后有毒且致癌,0
瘦子不会得脂肪肝,0
喝牛奶导致乳腺癌,0
吃腊八蒜能防癌、软化血管,0
石家庄周边将用大炮打药消毒,0
新冠病毒会在咽喉滞留4天，要喝盐水和醋来消毒,0
吃自热食品会引发肠癌,0
洗发水中的“硅油”会导致脱发,0
长时间看手机会导致黄斑变性,0
吃冷冻肉有害健康,0
泡发食物都很危险，都会造成米酵菌酸中毒,0
接种疫苗等于百分百不得病,0
每天喝二两白酒真可以防治新冠肺炎,0
“囤肉”长胖能抗寒,0
酒精浓度越高消毒效果越好,0
脱脂牛奶比全脂牛奶更健康,0
量子计算机已可取代经典计算机,0
“自发热内衣”可以自发热、年轻人火气旺不用多穿……,0
有高危因素就一定会得胃癌,0
哪儿冷脂肪就会去哪儿，露出的地方更容易长肉,0
1月初，网传“合肥2020年GDP破万亿元”,0
1月15日重型货车禁止上路行驶,0
打呼噜不是病,0
痛经喝红糖水,0
中药=补药，可长期食用,0
新冠病毒是“小号艾滋”,0
“阳康”后需要继续用药巩固疗效,0
青岛一医院发现3例XBB病毒患者,0
宁波一医院发布“新冠后要像坐月子一样休养”,0
感染XBB1.5会失禁,0
河北一景区“阳康”游客心衰死亡6人,0
服用布洛芬或导致死亡,0
德尔塔等变异株在北京流行,0
成都“一初中生感染新冠白肺重症去世”,0
浙江丽水、温州有“新冠阳性患者康复洗澡后死亡”,0
5天内感染2种毒株,0
2020年病毒株、德尔塔又来了？北京、武汉回应,0
“北京地坛医院封了”,0
北方有德尔塔和奥密克戎共循环或有重组,0
“北京自来水阳了”,0
饮高度酒可以对抗新冠病毒,0
能预防？能退烧？这些“新冠民间偏方”靠谱吗,0
病毒一直变异，打疫苗无用,0
复阳者是因为没换牙刷,0
国家要求快递业1月8日停业,0
传何祚庥院士染疫无人问津,0
花2000元考核酸采样员证书，没上岗就失业？警方通报来了,0
胖人、颜值高的人不容易得新冠,0
蘸盐水捅鼻子防治新冠,0
上海、贵阳新华路派出所户籍室人员全阳，业务停办,0
混管核酸异常，按链接操作查阅,0
接种新冠疫苗可申领补偿,0
西安、长沙长安郡小区一儿童新冠病毒并发症去世,0
抗原检测显示阴性意味着没感染,0
新冠病毒阳性感染者只是咳嗽、发烧就算无症状,0
科学防疫！别再被这些传言误导了,0
关于疫情防护和治疗，这些传言需要澄清,0
国务院联防联控小组正式摘牌,0
上海闵行区防控办解散了,0
河渑池返校复课时间确定，还附链接,0
“5日15时，长沙市所有封控区、管控区、防范区全部解封”,0
长期戴口罩会导致肺结节,0
杭州萧山区第一人民医院在建方舱医院,0
“陕西省防疫新十条”,0
湖省政府发布疫情防控“省十条”,0
发布“连云港封城”不实信息，造谣人员被依法处理！,0
一网民散布“宜春将再次封城”谣言被警方依法处理,0
“郑州会展中心方舱医院12点清零”,0
天津某方舱医院招聘志愿者,0
奥密克戎病毒更名为新型冠状病毒感冒,0
天津市12月5日起陆续恢复线下教学,0
未做核酸进不了医院，一女子当街产子,0
12月1日天津继续全市大筛,0
广州站被封、旅客滞留,0
成都一小区核酸检测样本被丢弃,0
吃橘子会致新冠病毒核酸检测呈阳性,0
“根据黄石市疫情防控要求，对鄂城来黄石的一律劝返”,0
编造散布疫情谣言，一人被江西萍乡警方行政处罚！,0
成都网约车平台将保持静默不派单,0
一男子冒充疫情防控工作人员散布疫情谣言，被西安警方刑事拘留,0
疫情期间，北京自来水内加大氯气注入,0
涉天津市疫情防控十条措施的紧急通知,0
“第1号通告”武汉暂停客运,0
北京朝阳区太阳宫公园搭了帐篷“方舱”,0
“拉萨市第八中学11月21日报到”,0
粤A牌车辆离穗在高速路出口被劝返,0
江苏通一男子编造、散布疫情谣言被行政处罚,0
“江苏丹阳临时静态管控”,0
重庆方舱医院收费,0
重庆市渝北区一男子冒充警察发表涉疫不实言论被警方抓获并受案调查,0
“重庆全城出租汽车和公交车全部停运”,0
“重庆北站羊儿客拉人到方舱医院有补贴”,0
“重庆荔枝园核酸检测造假”,0
广东有人被封控在公厕内,0
呼和浩特市近期将进行肛拭子核酸检测,0
到访过国家会展中心（天津）的人员，实施居家隔离并赋“红码”,0
“石家庄查出白肺”,0
山东新泰封城抢物资,0
广州海珠城中村内孕妇流产,0
“兰州市城关区截止昨天确诊20万”等为不实信息！,0
疫情防控发布会给宠物店带货,0
“一阳性患者开车撞死5个人”,0
重庆石子山方舱医院无人管睡厕所,0
广州市教育局：全市中小学停止线下教学、幼儿园停止入园系谣言,0
“郑州某核酸采样窗口给空气做核酸”信息不实！,0
一医生因封控无法给患儿做手术,0
“错过女儿成人礼”的社区书记名下有公司,0
男子贩卖8000余张通行证,0
“张家口市宣化区彻底封城一周”系不实消息！,0
淄博市临淄区依法查处两起“涉疫情”造谣违法行为,0
京建邺区有外卖小哥核酸阳性,0
新疆“解封一段时间后继续封控”,0
“天津常态化核酸检测今日起收费”,0
临沂高新区将封控,0
封校期间，大学生一天可领50元补贴,0
“要求所有中职、高职、大学生11月5日离郑”,0
“疫情期间可领取补贴”,0
西安发烧人群剧增？路过就得隔离,0
北京平谷区“飞机喷洒打药”,0
山西运城“过几天还要大封？”,0
山东德州“今晚进行大面积消毒”,0
福建平潭31日核酸检测暂停？一桥、二桥封闭,0
呼和浩特封控小区将免费配送蔬菜食品？居家隔离人员将享受补贴,0
西宁一颗大白菜“49.31”元？电梯停运致人死亡,0
京栖霞片区多趟线路暂时停运,0
军方强制管控滕州,0
男子确诊阳性被吊车吊起转移？福州封城公交停运,0
合肥部分区域10月27日恢复线下教学,0
西安全市静默,0
四川广元利州区超市、市场将关闭,0
乌兰浩特市全市封城,0
广州花都封城,0
宁波地铁站里临时改建隔离点,0
商丘市睢阳区一网民发布涉疫情不实信息被约谈,0
泰安封城,0
郑州全域实行3天静默管理,0
新疆维吾尔自治区互联网信息办公室等有关部门查处曝光4起网上违法违规行为典型案例,0
衡水市主城区将静默管理,0
四川宜宾某小区排队做核酸插队打架,0
山东肥城市所有学校于10月10日由防疫部门接管,0
太原市返校日期为10月11日,0
上海游客遇新疆疫情，变身葡萄采摘工，120元1天包吃包住月底回家,0
下周开始上海全市中小学生停课,0
兰州10月10日将封闭管理,0
出公共场所再扫场所码可避免成为密接者,0
核酸检测的采样棉签有毒,0
四川宜宾一上午确诊250个,0
四川罗江封了,0
上海有人“持红码到酒吧蹦迪”,0
新疆维吾尔自治区互联网信息办公室等有关部门查处曝光5起网上违法违规行为典型案例,0
重庆江北国际机场被封,0
散布涉疫太原疫情网络谣言，行政拘留十日！,0
一男子散布涉包头疫情网络谣言 行拘5日！,0
四川德阳中江要封城,0
新疆查处曝光4起网上违法违规行为典型案例,0
四川遂宁7日12:30后就静态管理,0
10月1日起天津封城3天,0
天津开大悦城附近小区确诊9例阳性,0
防疫期间，绵阳自来水需静置二至三小时后再饮用,0
济宁市主城区9月28日封城,0
宁波海曙区阳性病例“23日去过奥特莱斯”,0
有人为逃避检查从遂宁市城区走路回大英县,0
天津古文化街景区出现阳性待复检,0
广东珠海产妇进医院无核酸被迫街边产子,0
温州苍灵溪镇疑似出现阳性病例,0
天津市武清区大孟庄镇、大良镇出现阳性确诊病例,0
四川遂宁市所有路口将由部队接管,0
新疆伊宁市此次病毒属于流感病毒,0
新疆本地核酸检测机构不参与检测、全部由内地的检测机构检测,0
贵阳一住户在家不戴口罩被抓走,0
江西赣州经开区将实行临时静态管理,0
疫情非常时期，新疆自来水要静置两小时,0
新冠阳性患者返回四川自贡，致使某小区封楼数栋,0
山东济宁任城区要封城,0
喝茶能消灭新冠病毒？吃果蔬喝肉蛋会感染新冠,0
中学生归家导致小区新增阳性？黑衣女子脚踹工作人员,0
海“儋州大洲桥附近有新增阳性感染者”,0
“青岛市妇幼城阳院区受疫情影响临时停诊”,0
“大连金普一工作人员酒后上岗及打人情况”系不实信息,0
天津筛出100多例核酸阳性？警方通报：系谣言，已依法受案！,0
海三亚又将开启全域封闭式管理,0
成都市武侯区簇锦街道：网传“兴元丽园小区一家五口均阳性”信息不实,0
疫情不可怕，谣言才可怕！带你识破贵州这些涉疫谣言,0
贵阳居委会志愿者将他人捐赠的白菜进行售卖,0
成都某小区一阿姨误喝核酸试管水,0
“钟山已到四川内江指导抗疫”,0
"四川""北川一人吃酸菜鱼感染病毒致死""",0
贵阳花果园有人翻窗逃离,0
贵阳世纪城捐赠物资被高价售卖,0
辟谣！网传济宁长沟葡萄检测出阳性等消息不实,0
贵阳后坝草黄路没得饭吃的出来闹事了,0
四川宜宾叙州区超市、农贸市场要关门,0
国家疾控接管贵阳市中天甜蜜小镇？钟山也来了,0
成都郫都友爱镇“一千多人拉走了”,0
四川省宜宾市第一中学校招募志愿者,0
上海去世老人核酸报告为何还在更新,0
公交车是买菜车？印江捐的抗疫物质被变卖？这些都是假的！,0
羊圈成隔离点,0
“西宁可能要封城”等不实消息 西宁警方依法行政处罚4人,0
“青岛莱西有新冠了”,0
济再通报3起疫情防控违法行为典型案例,0
黑龙江大庆“孕妇就医被拒导致流产”,0
济宁市公安局兖州分局通报1起涉疫违法行为,0
三亚深夜将用无人机全域消杀,0
成都“空港16区物业管理不善，被部队接管”,0
中秋节深圳福田封区三天,0
三亚某安置区有人跳楼,0
成都全市餐饮外卖停业,0
深圳福田区某村一家三口跳楼,0
青岛“今晚不要开窗户 半夜会大面积全面消杀”,0
一码扫两次可防止成“密接”,0
大连“今晚将飞机打药全面消杀”,0
济宁“半夜对大面积全面消杀”,0
济宁古槐路有人开车撞防疫人员,0
9月12日起海三亚将陆续解封,0
今晚不要开窗户？贵州贵阳半夜要大面积消杀,0
河鹤壁自9月6日起连做7天核酸“静默”一周,0
海儋州静态管理结束时间暂定为9月15日,0
山东济宁鱼台10个确诊,0
警情通报！散布“济宁市企业停产三天”等虚假消息被查处,0
天津火车站因疫情被封……,0
济宁金乡一居民在网络上发布疫情虚假视频 罚！,0
9月12日起三亚将陆续解封,0
“济宁市企业停产3天”“明天起济宁封城”,0
海万宁9月3日确定解封,0
上海杨浦区学校线下教学延后转为线上,0
一码扫两次就能识别你已离开,0
深圳全市暂停三天？全员足不出户,0
用了核酸码检测，离线码就失效,0
天津河西一小区出现借密接之名强行带走孩子,0
石家庄市新华区“瞒报行程、确诊5例、核酸插队打架一人死亡”,0
8月29日晚成都将静态管理,0
"海口""健康码24小时后变黄码,需认证绑定""?",0
三亚29日起有序放宽市场、商超,0
"新疆库尔勒""明日可下楼活动,按户发通行证""?",0
核酸和抗原做多了，咽喉癌和鼻咽癌会增多,0
河三门峡“采购肉类有阳性”,0
成都环球中心水体样本呈阳性,0
23日0时起，西安实行封闭式管理,0
海口市中小学8月31日注册和9月1日开学,0
大庆“今晚半夜大面积消杀？”,0
“海花岛隔离女童生病无人问津”,0
“西藏疫情发展拐点已出现”,0
三亚新鸿港市场暂停交易影响蔬菜供应,0
拉萨“有人去派出所报警，现在派出所被封”,0
“西宁要封城”,0
海儋州“美团骑手集体被隔离”,0
汉中网安查处一起发布涉疫谣言案件,0
这则昆明盘龙区的公告并非官方发布,0
三亚“全城一律不给进出”,0
海昌江红棉广场出现阳性病例,0
海口城市花园一家三口才做一次核酸,0
